conference,year,session name,paper title,DOI,author list,abstract
IUI,2026,,Towards Adaptive Mixed-Initiative Media Recommender Systems with LLMs,https://scholar.google.com/scholar?hl=en&as_sdt=0%2C10&q=Towards+Adaptive+Mixed-Initiative+Media+Recommender+Systems+with+LLMs,Ulysse Maes,"Recommender systems (RS) increasingly shape how people encounter digital media, but often leave users with limited understanding of why items are recommended and few ways to influence them. Existing user interfaces (UIs) typically offer static, one-size-fits-all explanations and controls that do not reflect users' dynamic needs, limiting user agency. My research investigates how mixed-initiative recommender interfaces, enabled by large language models (LLMs), can adapt explanatory and interactive elements to users' dynamic needs. I plan to develop a conceptual model that links situational media needs to requirements for information (understanding) and interaction (control). Building on this model, I will design and experimentally evaluate adaptive UIs that combine personalized explanations with interactive controls, measuring their effects on user understanding and perceived control. Through this doctoral consortium, I seek feedback on my research plan and guidance in designing effective experiments on adaptive mixed-initiative RS."
IUI,2026,Posters,From Data to Dialogue: A Multi-Agent Chatbot Interface for Decision Support in Guide Dog Training,https://scholar.google.com/scholar?hl=en&as_sdt=0%2C10&q=From+Data+to+Dialogue%3A+A+Multi-Agent+Chatbot+Interface+for+Decision+Support+in+Guide+Dog+Training,"Adir Solomon, Elena Shamis, Ami Toren, Carmel Weiss, Orna Braun, Anna Zamansky","Guide dog training programs collect extensive behavioral, medical, and performance information for every dog, including the Behavioral Checklist (BCL), which can contain over 50 detailed assessment items per dog. Trainers rely on these records, together with data from thousands of past dogs, to judge whether a dog is on track, where it is struggling, and whether it is likely to succeed in the training program. Furthermore, although all this information is stored in organizational digital databases, trainers often can not use it in practice because the data requires technical processing, aggregation, and interpretation. To bridge these gaps, we present a multi-agent conversational chatbot that embeds the predictive model and the data processing pipeline inside a dialogue-based interface. Instead of navigating complex databases or analytical tools, trainers can ask natural-language questions such as “How does this dog compare to past dogs with similar profiles?” Our suggested chatbot retrieves relevant information, analyzes it using structured data and model outputs, and presents clear information that supports daily training decisions. We conducted a formative study with three professional experienced guide dog trainers across three main tasks: information analysis, dog comparison, and success prediction. Trainers reported that the chatbot made the underlying information more approachable, more interpretable, and easier to apply when making decisions about each dog’s training trajectory."
IUI,2026,,"Beyond the Conversational Paradigm: Models, Design Principles, and Tools for Advancing the Spectrum of Human-LLM Interaction",https://scholar.google.com/scholar?hl=en&as_sdt=0%2C10&q=Beyond+the+Conversational+Paradigm%3A+Models%2C+Design+Principles%2C+and+Tools+for+Advancing+the+Spectrum+of+Human-LLM+Interaction,Laura Colazzo,"Interaction with Large Language Models (LLMs) is expanding beyond strictly Conversational User Interfaces (CUIs), with systems starting to incorporate direct-manipulation mechanisms, typical of Graphical User Interfaces (GUIs), into their designs. We argue that the current landscape of human–LLM interfaces can be described as a continuum, ranging from strictly conversational to increasingly visual and interactive interfaces built on top of a basic CUI. Based on this assumption, the doctoral research presented in this paper aims to model and analyze this CUI–GUI spectrum. Grounded in a Human-Centered Design methodology and a research-through-design approach, the work investigates factors influencing users’ preferences for different interface configurations along the spectrum, through comparative empirical studies, and leveraging representative interface prototypes across it. Insights from these studies will inform the design of adaptive LLM interfaces that dynamically adjust the balance between conversational and graphical elements in response to users’ needs and contextual factors. In parallel, the research will explore both risks and benefits associated with different regions of the spectrum, with the ultimate goal of developing a comprehensive characterization, as well as a set of design principles and tools that can effectively guide the design of the next generation of human–LLM interfaces."
IUI,2026,Posters,Enhancing Vignette-Based Research Through AI-Generated Storyboards,https://scholar.google.com/scholar?hl=en&as_sdt=0%2C10&q=Enhancing+Vignette-Based+Research+Through+AI-Generated+Storyboards,"Mohana Sravya Appalaneni, Tianyi Li","The representational form of vignettes is often treated as incidental in scenario-based research, despite its potential impact on participants’ understanding and reasoning processes of complex situations. This work outlines the research pipeline to transform text-based vignettes into low-fidelity storyboards using generative AI that remain faithful to the original text, visually consistent across conditions, and neutral with respect to unintended interpretive cues. Rather than aiming for visual realism, the pipeline prioritizes narrative clarity, stylistic simplicity, and experimental control, allowing representational format to be examined as a methodological factor. By making storyboard generation reproducible and transparent, this work highlights presentation modality as an important consideration in vignette-based research and provides a foundation for studying how visual storyboards may affect cognitive load, interpretation of experimental manipulations, and perceived communicative quality in intelligent user interface and human-AI interaction research."
IUI,2026,Posters,Feasibility of Activity Fingerprints for Glucose Prediction,https://scholar.google.com/scholar?hl=en&as_sdt=0%2C10&q=Feasibility+of+Activity+Fingerprints+for+Glucose+Prediction,"Veronika Bogina, Tal Yahalom-Peri, Tsvi Kuflik, Einat Kodesh, Tali Cukierman-Yaffe","Proactive health interfaces require accurate forecasting of physiological states to deliver timely interventions. In this work-in-progress, we investigate the feasibility of predicting short-term glucose dynamics in older adults with Type 2 Diabetes (T2D) using ""activity fingerprints"" - frequency-domain features derived from wearable posture signals. Analyzing data from 105 participants, we utilize Fast Fourier Transform (FFT) to capture individualized movement rhythms. Granger causality analysis identifies these rhythms as leading indicators of glucose changes with a predictive horizon of approximately 40 minutes. We demonstrate that an XGBoost model utilizing these fingerprints outperforms standard baselines (Mean Prediction and Last-Value-Carried-Forward). These preliminary findings validate the potential of posture dynamics as a non-invasive predictor, laying the technical groundwork for future intelligent interfaces capable of prompting timely glucose measurements."
IUI,2026,,Understanding and Designing AI Systems that Reshape Social Dynamics in Group Decision-Making,https://scholar.google.com/scholar?hl=en&as_sdt=0%2C10&q=Understanding+and+Designing+AI+Systems+that+Reshape+Social+Dynamics+in+Group+Decision-Making,Soohwan Lee,"As AI integrates into teams and organizations, it can influence how people communicate, collaborate, and make decisions. I study AI not only as a tool, but as a social actor that can reconfigure group dynamics, power relations, and collective reasoning. My dissertation asks how AI changes group thinking, decision-making, and value exploration, and how we can design it to support more inclusive outcomes. So far, I have completed two studies.  First, I conducted a controlled experiment with three LLM agents to investigate the influence patterns of majority, minority, and diffusion over time, and I observed distinct trajectories of opinion change and confidence across tasks.  Second, I developed an LLM-powered system that supports minority voices in power-imbalanced group discussions by providing counterarguments or AI-mediated messages. The results show a clear trade-off between participation and psychological safety.  Next, I will develop a Value Constellation dashboard that visualizes hidden value conflicts to prompt group reflection and reduce groupthink."
IUI,2026,Posters,SmartUI: Human-in-the-Loop Editable Interface Generation through Semantic Structures,https://scholar.google.com/scholar?hl=en&as_sdt=0%2C10&q=SmartUI%3A+Human-in-the-Loop+Editable+Interface+Generation+through+Semantic+Structures,"lin sheng, Danba Wangzha, Jinchen Shen, Fangyuan Chang, Zhenyu Gu","Generative Artificial Intelligence (AI) is transforming interface design by enabling automatic layout generation from natural language prompts. However, existing generative UI systems primarily focus on one-shot synthesis and lack structural editability, limiting designers’ ability to iteratively refine and reuse generated results. This paper presents SmartUI, a Figma-based, human-in-the-loop generative interface design plugin that supports fine-grained user editing throughout the entire design workflow, including both pre-generation requirement refinement and post-generation interface modification. SmartUI introduces a Structured UI Language (SUL) to represent design intent, hierarchical logic, and component relationships, establishing a high-fidelity mapping between semantic input and interface structure. Based on a statistical analysis of 7,381 webpages, we develop a high-frequency taxonomy of container and non-container components, providing a stable semantic foundation for layout generation. Experimental results demonstrate that SmartUI achieves a structure consistency of 0.93 and significantly improves generation speed, component reuse rate, and reduces modification operations compared to manual workflows. These findings highlight SmartUI’s potential to enable editable, efficient, and reusable generative design in human-centered creation processes. We will release the smartUI to https://github.com/sssala/SmartUI"
IUI,2026,Posters,A Privacy-Preserving Hypercube Framework for Interactive Recommendations,https://scholar.google.com/scholar?hl=en&as_sdt=0%2C10&q=A+Privacy-Preserving+Hypercube+Framework+for+Interactive+Recommendations,"Adir Solomon, Alan Wecker, Noa Tuval, Alain Hertz, Tsvi Kuflik","Interactive decision-support systems increasingly rely on cloud-based recommender architectures, which introduce latency, energy consumption, and privacy concerns that may negatively affect user experience and trust. In this paper, we present a content-based, on-device recommendation framework in which all inference is performed locally, without server-side computation or data sharing. The approach is based on a lightweight hypercube representation of items, enabling efficient and interpretable personalization. The system is designed to operate across multiple domains, including movies and restaurants, and supports extensions that incorporate side information, such as features extracted from textual reviews. We report initial qualitative findings from a user study in the movie domain, focusing on users’ perceptions of usability, personalization, and privacy."
IUI,2026,Demos,Multi-Agent Framework for Adaptive Social-Emotional Learning in Children's Digital Communication,https://scholar.google.com/scholar?hl=en&as_sdt=0%2C10&q=Multi-Agent+Framework+for+Adaptive+Social-Emotional+Learning+in+Children%27s+Digital+Communication,"Amit Malik, Ofri Elbaum, Tomer Malkevich, Zohar Elyoseph, Adir Solomon, Rotem Dror, Oshrat Ayalon","In today’s digital society, children are increasingly exposed to online communication environments at an early age, often before they have developed the social and emotional skills required to manage misunderstandings, conflicts, and emotionally charged interactions. We present Lilo, an interactive multi-agent conversational system designed to help children aged 8 to 11 practice safe, empathetic, and reflective digital communication. Lilo offers scenario-based chat simulations that resemble familiar messaging platforms, allowing children to experiment with communication strategies in a protected environment without real-world social consequences. The system integrates adaptive conversational agents with a structured intervention mechanism based on the Stop–Think–Act pedagogical framework. This demo paper presents the system design, interaction model, and educational rationale underlying Lilo, and demonstrates how large language models can be leveraged to support social and emotional learning through guided digital interaction."
IUI,2026,Demos,"filescape: A Non-Hierarchical, Privacy-Preserving Visual AI System for Personal File Organization and Exploration",https://scholar.google.com/scholar?hl=en&as_sdt=0%2C10&q=filescape%3A+A+Non-Hierarchical%2C+Privacy-Preserving+Visual+AI+System+for+Personal+File+Organization+and+Exploration,"Aashna Majmudar, Kevin Dunnell, Andrew Lippman","We present filescape, a non-hierarchical, privacy-preserving visual AI system for personal file organization and exploration. As inexpensive, persistent digital storage has expanded personal file collections across devices, folder hierarchies and keyword search have become increasingly brittle for re-finding and sense-making.  filescape presents personal documents as a 2D embedding-based spatial map built with lightweight, locally hosted embedding and language models, providing an at-a-glance overview for rapid re-finding, pattern recognition, and open-ended exploration. filescape integrates with existing operating-system workflows (e.g., macOS Finder) and reflects filesystem changes in real time. The interface combines WYSIWYG previews, interactive clustering, and semantic navigation to support exploration without sacrificing privacy or requiring cloud services. A pilot study comparing filescape to macOS Finder suggests that embedding-based spatial interfaces can improve re-finding efficiency and user experience."
IUI,2026,Posters,Chatbots or Apps? Design Tradeoffs and the Need for Hybrid Health Interfaces,https://scholar.google.com/scholar?hl=en&as_sdt=0%2C10&q=Chatbots+or+Apps%3F+Design+Tradeoffs+and+the+Need+for+Hybrid+Health+Interfaces,Michael Sobolev,"Large language model (LLM)–based chatbots are emerging as persuasive interfaces in digital health, yet their advantages relative to established mobile apps remain uncertain. We present a comparative field study (N = 167) evaluating two smoking-cessation digital interventions: QuitBot, an LLM-driven conversational coach, and quitSTART, a structured mobile app. Participants selected one of these, used it for a week, and reported on usability, engagement, and perceived effectiveness. Quantitative findings showed that QuitBot was experienced as easier and more natural to use, while quitSTART prompted more frequent daily engagement and a greater proportion of users to plan a quit date. Qualitative analysis revealed parallel strengths: QuitBot fostered empathy, motivation, and social presence, whereas quitSTART reinforced predictability, goal-setting, and progress tracking. Together, the findings highlight a potential trade-off between relational adaptivity and structural scaffolding in persuasive health interfaces, suggesting that hybrid intelligent systems integrating both dimensions may better sustain engagement and support long-term behavior change."
IUI,2026,Posters,From Verification Burden to Trusted Collaboration: Design Goals for LLM-Assisted Literature Reviews,https://scholar.google.com/scholar?hl=en&as_sdt=0%2C10&q=From+Verification+Burden+to+Trusted+Collaboration%3A+Design+Goals+for+LLM-Assisted+Literature+Reviews,"Brenda Nogueira, Werner Geyer, Andrew A. Anderson, Toby Jia-Jun Li, Nuno Moniz, Nitesh V Chawla, Dongwhi Kim","Although numerous studies have examined how researchers use Large Language Models (LLMs) in academic writing, their concrete implementation, limitations, and design challenges in the literature review process remain underexplored. In this paper, we present findings from a user study with researchers across multiple disciplines that characterize current practices, benefits, and pain points when using LLMs to investigate related work. We identified three recurring gaps: (i) lack of trust in outputs, (ii) a persistent verification burden, and (iii) fragmentation across tools. To address these gaps, we propose six design goals and a high-level framework that operationalizes them through improved visualization of related papers, verification at every step, and human-feedback alignment with generation-guided explanations."
IUI,2026,Posters,RAMA: Regulation Aware Multimodal Alignment for Misbranding Detection in Product Advertisements,https://scholar.google.com/scholar?hl=en&as_sdt=0%2C10&q=RAMA%3A+Regulation+Aware+Multimodal+Alignment+for+Misbranding+Detection+in+Product+Advertisements,"Diya Saha, Abhishek Bharadwaj Varanasi, Manjira Sinha, Tirthankar Dasgupta","Misbranding of health-related products poses significant risks to public safety and regulatory compliance. Existing approaches to claim verification largely rely on keyword matching or generic text classification, failing to capture the nuanced reasoning required to align product claims with legal statutes. In this work, we introduce RAMA: A Regulation Aware Multimodal Alignment for Misbranding Detection, a novel framework that formulates misbranding detection between product claims and regulatory provisions. Leveraging a curated dataset of FDA warning letters, we construct structured representations of claims and statutes using natural logic trees, enabling interpretable and rule-consistent reasoning. Our model integrates a regulation-aware gating mechanism with a contrastive alignment objective to jointly optimize misbranding classification and statute mapping. Extensive experiments on the \textsc{FDA-Misbrand} dataset demonstrate that RAMA significantly outperforms strong baselines across accuracy, F1-score, and regulation alignment metrics, while providing interpretable attention patterns that highlight critical linguistic cues.  "
IUI,2026,Posters,AIoT Smart Home Automation Architecture: Autonomous Decision-Making Powered by Multimodal Large Language Models (MLLMs),https://scholar.google.com/scholar?hl=en&as_sdt=0%2C10&q=AIoT+Smart+Home+Automation+Architecture%3A+Autonomous+Decision-Making+Powered+by+Multimodal+Large+Language+Models+%28MLLMs%29,"He Zhang, Yuewen Zhang, Bochen Li, Wen Chen, Yueyan Liu, Qianyao Xu, Xinyi Fu","Traditional smart home systems often rely on heterogeneous sensors and rigid rule-based pipelines, which limit scalability, flexibility, and ease of deployment. We propose a highly extensible smart home framework driven by multimodal large language models (MLLMs), utilizing a single camera as the minimal sensing unit for unified home environment perception, structured labeling, and autonomous decision-making. Our system automatically generates standardized tags, such as cleanliness, object locations, and human activities, to enable functions like cleaning scheduling, health reporting, and object tracking. These tags can also be extended to organize and integrate additional data sources, supporting comprehensive and scalable smart home management. Preliminary results demonstrate the feasibility and promise of this single-camera, MLLM-powered approach for smart home automation."
IUI,2026,Posters,SitWell: An Intelligent User Interface for Real-Time Posture Monitoring and Clinically-Informed Feedback,https://scholar.google.com/scholar?hl=en&as_sdt=0%2C10&q=SitWell%3A+An+Intelligent+User+Interface+for+Real-Time+Posture+Monitoring+and+Clinically-Informed+Feedback,"Janusz Kulon, David Faith Odesola","Prolonged sitting is a significant health concern, linked to musculoskeletal disorders and chronic pain. While existing smart chairs often provide generic alerts, they lack the personalization necessary for long-term behavior change, especially for individuals with pre-existing conditions. We present SitWell, an intelligent User Interface (UI) that leverages dual pressure-mapping, cloud-based machine learning, and Large Language Models (LLMs) to deliver personalized, context-aware postural coaching. The system employs a user-tailored Convolutional Neural Network (CNN) trained on individual pressure data, achieving above 90% accuracy in classifying custom postures. A novel contribution is the integration of LLM, which analyzes a user’s postural timeline and clinical profile to generate actionable, personalized recommendations. SitWell demonstrates how personalized AI and generative models can be integrated into a human-centered interface to bridge the gap between clinical expertise and daily health maintenance."
IUI,2026,Posters,Understanding EEG Microstate–Based Dementia Detection with Explainable AI,https://scholar.google.com/scholar?hl=en&as_sdt=0%2C10&q=Understanding+EEG+Microstate%E2%80%93Based+Dementia+Detection+with+Explainable+AI,"Quoc-Toan Nguyen, Linh Le, David Williams-King, Quang-Hieu Tang, Nghia Duong-Trung","Alzheimer’s disease (AD) is a leading cause of dementia worldwide, and early detection plays a critical role in enabling timely care and improving quality of life. While deep learning models based on electroencephalography (EEG) microstate representations show strong potential for early AD detection, their complex temporal behaviour generally makes decisions difficult for humans to understand and rely on. This paper presents an explainable approach for temporal EEG microstate classifiers, which helps users understand how brain dynamics contribute to individual predictions. The proposed method produces time-aligned, microstate-aware explanations that reveal which temporal segments and microstate patterns influence AD and normal control decisions. Developed based on a fixed, pre-trained microstate-based dementia detection model across multiple EEG datasets, the approach improves the transparency and interpretability of AI decisions. By translating model behaviour into meaningful temporal brain patterns, this work advances a human-centred approach towards trustworthy AI for EEG-based clinical decision-making for more precise outcomes."
IUI,2026,Posters,Looking Back to the Future: Characterizing Feedback Loops in Adaptive Systems,https://scholar.google.com/scholar?hl=en&as_sdt=0%2C10&q=Looking+Back+to+the+Future%3A+Characterizing+Feedback+Loops+in+Adaptive+Systems,I. Scott MacKenzie,"We examine adaptive systems wherein feedback loops adjust system properties to enhance the user experience or interaction performance. Through examples it is illustrated that the range of duration for feedback loops is huge, from less than one second to months, even years. To fully encapsulate the range of possibilities, a modified time-scale of human action model is presented. The model uses world views and bands to position human actions by their duration. Using a log scale, actions are positioned in bands with duration ranging from less than one second to years and beyond. This paper is a call to research in intelligent and adaptive systems to more fully describe, quantify, and characterize the feedback loops for adaptation."
IUI,2026,Posters,Designing Persuasive Messages Using Hypothesis Generation from Large Language Models,https://scholar.google.com/scholar?hl=en&as_sdt=0%2C10&q=Designing+Persuasive+Messages+Using+Hypothesis+Generation+from+Large+Language+Models,Michael Sobolev,"Designing persuasive messages is central to intelligent user interfaces such as mobile health apps and chatbots, yet predicting which features of language drive persuasiveness remains a challenge. This paper presents a data-driven framework that integrates human judgments, large language models (LLMs), and machine learning to generate hypotheses about persuasive message design. In a study with N = 1,348 participants evaluating 174 messages to reduce drinking behavior, message-level preference varied widely (19–74%), motivating the search for systematic drivers of persuasion. Using ChatGPT as a hypothesis generator, the prompting surfaced plausible features such as framing outcomes as personal benefits, highlighting positive consequences, emphasizing concrete facts, orienting toward the future, and invoking protective health. This hybrid approach demonstrates how interpretable machine learning can extend beyond prediction to discovery, enabling researchers and designers to iteratively uncover the mechanisms of persuasion. This work contributes a generalizable method for hypothesis generation in persuasive systems, with implications for adaptive message design, behavior change interventions, and human-centered AI."
