conference,year,session name,paper title,DOI,author list,abstract
IUI,2026,"Novel Interaction (AR/VR, Embodied) (2/2)",ARIA: Toward Human-Centered Embodied AI Instruction in Real-Time Augmented Reality,https://scholar.google.com/scholar?hl=en&as_sdt=0%2C10&q=ARIA%3A+Toward+Human-Centered+Embodied+AI+Instruction+in+Real-Time+Augmented+Reality,"Abdul Mannan Mohammed, Martin McCarthy, Carsten Neumann, Gerd Bruder, Dirk Reiners, Carolina Cruz-Neira","Advances in artificial intelligence and embodied interaction in augmented reality (AR) are creating new opportunities for intelligent instructional systems that dynamically adapt to individual learners. However, sustaining real-time responsiveness while preserving natural, socially meaningful interaction remains a persistent challenge.This work introduces ARIA (Augmented Reality Instructional Agent), a real-time software architecture for embodied AI instruction in augmented reality. ARIA leverages large language models (LLMs) with adaptive prompt engineering to tailor dialogue style, instructional strategy, and persona expression to each user. Its modular pipeline is optimized for robust, low-latency performance, with benchmarks reported for responsiveness and system stability. To complement the technical evaluation, user experience was assessed through standardized questionnaires, offering insights into perceived personalization, trust, and interaction quality. Quantitative and qualitative results demonstrate that ARIA achieves sub-second responsiveness, high pragmatic and hedonic usability, and a strong sense of co-presence and instructional trust. This work contributes a unified framework and reference architecture for developing adaptive embodied agents that combine technical efficiency with human-centered design, highlighting how real-time responsiveness can serve as the foundation for relational engagement in embodied AI instruction."
IUI,2026,Making Together: Collaborative AI in Creative Work (1/2),Agents in Concert: A Case-Study of Bringing AI to the Stage in Practice,https://scholar.google.com/scholar?hl=en&as_sdt=0%2C10&q=Agents+in+Concert%3A+A+Case-Study+of+Bringing+AI+to+the+Stage+in+Practice,"Stephen Brade, Teng Ma, Lancelot Blanchard, Kimaya Lecamwasam, Carlos Mariano Salcedo, Suwan Kim, Perry Naseck, Andrew Li, Matthew R Michalek, Sebastian Franjou, Anna Huang","Recent years have seen a surge in musical performances accompanied by generative agents. Artificial voices, timbres synthesized by neural networks, and agents that mirror or respond to human performers are rapidly taking the stage. In parallel, practitioners in human-computer interaction (HCI) and music technology have called for practice-based research that identifies the most salient affordances of these developments by examining their use in the real-world contexts of music making. To advance practice-based research on human-AI music creation, we present a longitudinal account of two months of codesign with top local jazz musicians, spanning early explorations, the identification of emerging goals, and rehearsals. Our work culminates in a public concert for a live audience of 97, featuring three pieces co-improvised with AI agents. Drawing on systems including \vampnet,  \somax, and the \jambot, each piece was tailored to the stylistic strengths of the performers and the unique strengths and limitations of each system.  Through this extensive iterative process, we uncovered a wide range of design interventions, from augmenting GenAI systems with a guitar pedal to situate it in a loop-based creative practice, to enabling musicians to anticipate AI response by visually forecasting its predictions. Where musicians tended to rein in the wilder qualities of the generative systems, some audience members expected a human-AI performance to allow as much agency and spontaneity as possible. In post-concert reflection, musicians also expressed the desire to practice more which in turn could enable them to let the agency of the systems shine. They also encouraged future musicians to lean more into the uncertainty. Together, we see a unique practice emerging through this musician-AI live improv medium."
IUI,2026,Natural and Intent Aware Interfaces,From Narrative to Numbers: Evaluating Survey Questionnaires with Large Language Models,https://scholar.google.com/scholar?hl=en&as_sdt=0%2C10&q=From+Narrative+to+Numbers%3A+Evaluating+Survey+Questionnaires+with+Large+Language+Models,"Akashdeep Chakraborty, Joseph LaViola","As the field of intelligent interfaces is evolving, there is also a growing need for feedback mechanisms that are both expressive for participants and also contain reliable and useful information for the researcher conducting the study for survey data collection. Our study involves exploring two different kinds of survey methods: a standardized slider scale for web-based surveys and a free-form text input with a Large Language Model (LLM) acting as a backbone. The experiment includes 36 participants completing a 4×4 sliding-tile game at two different levels (easy and hard) with difficulty standardized via Manhattan-distance targets. The response mode order was counterbalanced across two sequences. This task aimed to evaluate the accuracy and quality of participant responses through different survey methodologies. Our key findings are that the LLM survey results are equivalent to the ones reported through the Web-Based slider scale questionnaire method. Our contribution is an intelligent framework that allows text-based reflections within an adaptive survey interface, helping both participants to express their experiences naturally and also researchers to gain valuable information about their system."
IUI,2026,Explainable AI (XAI) Methods,Rules or Weights? Comparing User Understanding of Explainable AI Techniques with the Cognitive XAI-Adaptive Model,https://scholar.google.com/scholar?hl=en&as_sdt=0%2C10&q=Rules+or+Weights%3F+Comparing+User+Understanding+of+Explainable+AI+Techniques+with+the+Cognitive+XAI-Adaptive+Model,"Louth Bin Rawshan, Zhuoyu Wang, Brian Y Lim","Rules and Weights are popular XAI techniques for explaining AI decisions. Yet, it remains unclear how to choose between them, lacking a cognitive framework to compare their interpretability.  In an elicitation user study on forward and counterfactual decision tasks, we identified 7 reasoning strategies of interpreting three XAI Schemas—weights, rules, and their hybrid.  To analyze their capabilities, we propose CoXAM, a Cognitive XAI-Adaptive Model with shared memory representation to encode instance attributes, linear weights, and decision rules. CoXAM employs computational rationality to choose among reasoning processes based on the trade-off in utility and reasoning time, separately for forward or counterfactual decision tasks. In a validation study, CoXAM demonstrated a stronger alignment with human decision-making compared to baseline machine learning proxy models. The model successfully replicated and explained several key empirical findings, including that counterfactual tasks are inherently harder than forward tasks, decision tree rules are harder to recall and apply than linear weights, and the helpfulness of XAI depends on the application data context, alongside identifying which underlying reasoning strategies were most effective. With CoXAM, we contribute a cognitive basis to accelerate debugging and benchmarking disparate XAI techniques."
IUI,2026,Co-Creation for Design and Coding,"Whose Code Is It? How AI Autonomy Reshapes Ownership, Responsibility, and Disclosure in AI-Assisted Programming",https://scholar.google.com/scholar?hl=en&as_sdt=0%2C10&q=Whose+Code+Is+It%3F+How+AI+Autonomy+Reshapes+Ownership%2C+Responsibility%2C+and+Disclosure+in+AI-Assisted+Programming,"Jwawon Seo, Elmira Deldari, Helena M. Mentis","AI coding assistants are generating substantial portions of code, fundamentally challenging traditional notions of authorship and ownership in software development. We conducted a within-subjects experiment examining three AI coding assistant autonomy conditions-High (AI generates complete code), Medium (AI provides substantial suggestions), and Low (AI offers minimal assistance). We found that AI autonomy systematically reshaped developers' psychological relationships with code through distinct patterns across ownership dimensions.  Possession decreased continuously with each increase in AI contribution. Identity remained similar under Low and Medium autonomy but decreased substantially under High autonomy.  Responsibility decreased from Low to Medium and High autonomy, though developers maintained some sense of responsibility across all conditions. Attribution patterns revealed symmetric bidirectional shifts where ownership and responsibility attribution moved from predominantly Human-centered under Low autonomy through balanced uncertainty at Medium autonomy to predominantly AI-centered under High autonomy.  Despite these internal psychological shifts, professional disclosure practices showed striking stability. While developers became less comfortable claiming ownership to technical reviewers as AI contribution increased, their willingness to describe creation processes transparently and accept accountability for production systems remained consistent across all conditions. These findings illuminate how AI autonomy fundamentally restructures the psychological landscape of human-AI co-creation while developers preserve core professional obligations for transparency and accountability."
IUI,2026,User Modeling and Perceptions,Riding the Carousel: The First Extensive Eye Tracking Analysis of Browsing Behavior in Carousel Recommenders,https://scholar.google.com/scholar?hl=en&as_sdt=0%2C10&q=Riding+the+Carousel%3A+The+First+Extensive+Eye+Tracking+Analysis+of+Browsing+Behavior+in+Carousel+Recommenders,"Santiago de Leon-Martinez, Robert Moro, Branislav Kveton, Maria Bielikova","Carousels have become the de-facto standard user interface in online services. However, there is a lack of research in carousels, particularly examining how recommender systems may be designed differently than the traditional single-list interfaces. One of the key elements for understanding how to design a system for a particular interface is understanding how users browse. For carousels, users may browse in a number of different ways due to the added complexity of multiple topic defined-lists and swiping to see more items.  Eye tracking is the key to understanding user behavior by providing valuable, direct information on how users see and navigate. In this work, we provide the first extensive analysis of the eye tracking behavior in carousel recommenders under the free-browsing setting. To understand how users browse and model their behavior, we examine the following research questions : 1) where do users start browsing, 2) how do users transition from item to item within the same carousel and across carousels, and 3) how does genre preference impact transitions?   This work addresses a gap in the field and provides the first extensive empirical results of eye tracked browsing behavior in carousels for improving recommenders. Taking into account the insights learned from the above questions, our final contribution is to provide takeaways for carousel recommender system designers to better optimize their systems for user browsing behavior. The most important being an improved reordering of the ranked item positions to account for browsing behavior after swiping. These contributions aim not only to help improve current systems, but also to encourage and allow the design of new user models, systems, and metrics that are better suited to the complexity of carousel interfaces."
IUI,2026,User Modeling and Perceptions,Mind Mapper: Modeling and Predicting Behavioral Patterns from Everyday Conversations with Wearable AI Systems and LLMs,https://scholar.google.com/scholar?hl=en&as_sdt=0%2C10&q=Mind+Mapper%3A+Modeling+and+Predicting+Behavioral+Patterns+from+Everyday+Conversations+with+Wearable+AI+Systems+and+LLMs,"Valdemar Danry, Jean Ghislain Billa, Yasith Samaradivakara, Paul Pu Liang, Pattie Maes","Everyday conversations are more than exchanges of words—they reveal how people think, react, and adapt across situations. Through our speech we reveal the cognitive patterns that shape our behavior over time. Yet much of these patterns remains implicit: people operate through recurring heuristics and habits—some helpful, some limiting, many unnoticed. However, identifying such patterns requires self awareness that humans struggle with—and that current user modeling systems, often fragmented and narrowly tailored to specific tasks, fail to capture. Recognizing these patterns can enable user support systems to go beyond reactive assistance towards anticipatory support. We present Mind Mapper, an always-on wearable AI system that mines behavioral patterns from everyday real-life conversations. Mind Mapper employs a multi-stage LLM pipeline to generate, refine, and evaluate human-readable behavioral patterns. In a field study with {12 participants} capturing over 700 hours of real-life conversational data, {Mind Mapper generated behavioral patterns that participants consistently rated as accurate, unique, and helpful for reflection and behavior change.} We further illustrate how such behavioral pattern modeling might enable new forms of human-AI interaction—anticipating user behavior through proactive interventions, adaptive content delivery, cognitive reframing, and behavioral simulation. Our results show the potential of always-on wearable systems with LLM-driven user models to support new forms of cognitively scaffolding, context-aware human-AI interactions."
IUI,2026,Learning through Interaction (2/2),From Visual to Multimodal Programming: Designing an Interface to Externalize Decomposition Thinking for Novice Learners,https://scholar.google.com/scholar?hl=en&as_sdt=0%2C10&q=From+Visual+to+Multimodal+Programming%3A+Designing+an+Interface+to+Externalize+Decomposition+Thinking+for+Novice+Learners,"Changjae Lee, Qingxiao Zheng, Jinjun Xiong","Decomposition, the process of breaking down complex problems into manageable parts, is a fundamental component of computational thinking (CT) but remains challenging for novice learners. We present Spark, a multimodal programming interface that supports the externalization of decomposition thinking by organizing user-articulated goals into structured steps and enacting them through a tangible robot, making decomposition visible and open to inspection. The design of Spark is theory-driven, with its user interface aligned to three decomposition rationales: substantive, relational, and functional decomposition. In a study with 20 adult novices, we compared Spark with Scratch, an educational block-based visual programming interface. While both systems were associated with improvements in participants' self-reported decomposition skills, only Spark was associated with measurable gains on objective assessments and significantly higher task success when experienced first, while maintaining comparable workload and completion times. Participants reported that externalizing the otherwise hidden process of decomposition made programming more tangible and motivating. These findings, highlighting the complementary roles of multimodal interaction in shaping novices' decomposition experiences, inform the design of interactive programming interfaces that aim to support the externalization of reasoning processes. More broadly, our work contributes to the field of human-AI interaction in learning, illustrating how multimodal interaction can be responsibly integrated to scaffold reasoning, support reflection, and promote equitable participation in computing."
IUI,2026,Learning through Interaction (2/2),Playing with Privacy: Uncovering Everyday Judgments of Data Sensitivity Through an Arcade Machine Interface,https://scholar.google.com/scholar?hl=en&as_sdt=0%2C10&q=Playing+with+Privacy%3A+Uncovering+Everyday+Judgments+of+Data+Sensitivity+Through+an+Arcade+Machine+Interface,"Maksim Kalameyets, Rebecca Owens, Chi Fai David Lam, Shola Olabode, Vasilis Vlachokyriakos, Ben Farrand, Stergios Aidinlis, Lei Shi","Current data protection legal frameworks, including the GDPR, classify “special” categories of personal data that are deemed deserving of higher protection due to their impact on fundamental rights. Yet, these legal abstractions fail to capture how individuals themselves judge sensitivity in everyday digital contexts. This disconnect may undermine intelligibility and erode trust in data protection as a legal institution. Despite its centrality to privacy protection, limited empirical work has systematically compared public sensitivity judgments against the special categories of protected data under Article 9 GDPR. We address this gap through a mixed-methods design that integrates nine semi-structured interviews with a game-like survey deployed on public arcade machines. This approach generated 2,935 responses from 224 participants enabling in-situ analysis of everyday judgments. By operationalising an ontology capturing who collects data, what data are collected, and for what purpose, we systematically compared responses across demographic groups. Contrary to literature assumptions that health and financial data are primary markers of data sensitivity, our findings demonstrate that expressive content, messages, photos, and social ties elicited the strongest resistance to sharing by citizens. Acceptance was shaped decisively by purpose. Citizens tolerated safety and functionality, whilst advertising and vague claims of “research” were rejected. Attitudes varied systematically, with women disproportionately resistant to sharing expressive content, and higher education and digital literacy predicting greater caution. This study demonstrates that data sensitivity cannot be reduced to fixed legal categories. Rather, it is socially situated and purpose-dependent. Our findings provide empirical foundations for reimagining consent flows, privacy defaults, and transparency mechanisms that align with everyday logics. This can enable the development of systems that people can genuinely understand, trust, and consent to."
IUI,2026,AI-Augmented Work: Research and Education,Rationalizer: Leveraging LLM to Support User Providing the Rationales Behind the Rating of Likert Scale Questionnaires,https://scholar.google.com/scholar?hl=en&as_sdt=0%2C10&q=Rationalizer%3A+Leveraging+LLM+to+Support+User+Providing+the+Rationales+Behind+the+Rating+of+Likert+Scale+Questionnaires,"Meng Ting Shih, PO YEN WU, Yun Chen Chang, Grace Yu-Chun Yen, Liwei Chan","Surveys, especially Likert scale questionnaires, are widely used in HCI to capture users’ attitudes and experiences, but numeric ratings alone provide little insight into the rationales behind those ratings. While adding open-ended text fields or post-questionnaire interviews can elicit richer explanations, they often impose extra effort, leading to survey fatigue or recall bias. To address this gap, we proposed Rationalizer, an LLM-supported questionnaire system that generates contextualized rationales to support participants articulate their explanations alongside each Likert item and rating. In a user evaluation comparing it with the traditional questionnaire that included open-ended text fields, Rationalizer increased the percentage of Likert items with rationales, sustained participants’ willingness to provide self-input rationales, and supported them in articulating longer explanations within comparable writing durations as the study progressed. Quality analyses further showed that Rationalizer yielded higher-quality rationales (i.e., justification and relevance) than the traditional questionnaire. These findings highlight the potential of LLM-supported questionnaires to enrich Likert ratings with contextualized, richer explanations."
IUI,2026,"Persuasion, Trust & Appropriate Reliance",The Shape of My-AI: How Multimodality Shapes Trust and Persuasion in Interactions with an AI-Generated Future Self,https://scholar.google.com/scholar?hl=en&as_sdt=0%2C10&q=The+Shape+of+My-AI%3A+How+Multimodality+Shapes+Trust+and+Persuasion+in+Interactions+with+an+AI-Generated+Future+Self,"Constanze Albrecht, Chayapatr Archiwaranguprok, Rachel Poonsiriwong, Awu Chen, Monchai Lertsutthiwong, Kavin Winson, Pattie Maes, Hal Hershfield, Pat Pataranutaporn","AI-generated future selves allow people to engage in dialogue with a personalized digital representation of themselves decades ahead, yet it remains unclear how presentation modality shapes their psychological impact. We report a randomized between-subjects study (n=92) comparing three modalities of an AI-generated future self—text, voice, and a photorealistic talking avatar—against a neutral voice control. After evaluating multiple large language models for conversational quality, we implemented Claude 4 and integrated age progression, voice cloning, and facial animation. All personalized modalities significantly increased future self-continuity, particularly vividness and positivity, relative to control, with no reliable differences across text, voice, and avatar conditions. Although the avatar produced the largest vividness gain, effects were comparable across modalities. Instead, subjective interaction quality, especially perceived persuasiveness, realism, and engagement, strongly predicted gains in future self-continuity and affect, indicating that experiential quality matters more than interface form. Conversation analysis revealed modality-specific patterns, with text emphasizing instrumental career planning and voice-based interactions eliciting more existential reflection. These findings suggest that future-self interventions can scale through lightweight conversational formats when optimized for personalization and behavioral authenticity, while underscoring ethical considerations around persuasive influence and narrative authorship in self-referential AI systems."
IUI,2026,"Human-in-(and on)-the-Loop: Control, Oversight, and Iterative Learning (1/2)","""Un-default"" Behavior Tuning: Specifying Model Behavior outside the Norm with LLM Self-Playing and Self-Improving",https://scholar.google.com/scholar?hl=en&as_sdt=0%2C10&q=%22Un-default%22+Behavior+Tuning%3A+Specifying+Model+Behavior+outside+the+Norm+with+LLM+Self-Playing+and+Self-Improving,"Soya Park, J.D. Zamfirescu-Pereira, Chinmay Kulkarni","Specifying model behavior is challenging—especially when the desired behavior is unpopular relative to the model’s training data. Reversing the influence of massive training corpora is both time-consuming and costly, and such interventions are typically inaccessible to end users. While Large Language Models (LLMs) make it easier to write instructions using natural language, specifying unpopular behaviors remains a difficult task.  We introduce \Undefault{}, a human-in-the-loop framework that combines self-play with self-refinement to better specify such behaviors. Our system enables users to identify popular (but undesired) model behaviors through self-play, then iteratively guide the model toward preferred alternatives by refining prompts in a self-improving loop. Our first evaluation involves user study conducted on a system implementation of \Undefault{} within the context of chatbot behavior. Our system self-play itself by simulating user interactions to identify patterns and create effective prompts based on the pattern. In a within-subject study (N=12), participants pinpointed more patterns through self-playing and crafted better prompts. Surprisingly, users felt more or less success level in specifying the model behavior. Follow-up crowd studies (N=60) confirmed that the chatbot adhered to instructions without sacrificing quality. Our second evaluation is a case study on a real-world implementation using a movie rating dataset with \Undefault{}, demonstrating its effectiveness and robustness in modeling a critic's preferences across the spectrum of low to highly rated movies.  Together, these results suggest how AI improves the design process of interactive AI systems. Furthermore, they suggest how the benefits of these tools may be non-obvious to end-users. We reflect on these findings and suggest future directions.   "
IUI,2026,"Human-in-(and on)-the-Loop: Control, Oversight, and Iterative Learning (2/2)",Adaptive Prompt Elicitation for Text-to-Image Generation,https://scholar.google.com/scholar?hl=en&as_sdt=0%2C10&q=Adaptive+Prompt+Elicitation+for+Text-to-Image+Generation,"Xinyi Wen, Lena Hegemann, Xiaofu Jin, Shuai Ma, Antti Oulasvirta","Aligning text-to-image generation with user intent remains challenging, as users frequently provide ambiguous inputs and struggle with model idiosyncrasies. We propose Adaptive Prompt Elicitation (APE), a technique that adaptively poses visual queries to help users refine prompts without extensive writing. Our technical contribution is a formulation of interactive intent inference under an information-theoretic framework. APE represents latent user intent as interpretable feature requirements using language model priors, adaptively generates visual queries, and compiles elicited requirements into effective prompts. Evaluation on IDEA-Bench and DesignBench shows that APE achieves stronger alignment with improved efficiency. A user study with 128 participants on user-defined tasks demonstrates 19.8% higher perceived alignment without increased workload. Our work contributes a principled approach to prompting that offers an effective and efficient complement to the prevailing prompt-based interaction paradigm with text-to-image models."
