conference,year,session name,paper title,DOI,author list,abstract
UIST,2024,Demos,ScreenConcealer: Privacy-protection System with Obfuscations for Screen Sharing,doi.org/10.1145/3672539.3686750,"Mizuki Ishida, Kaori Ikematsu, Yuki Igarashi","During screen sharing in virtual meetings, there have been many cases of unintentional disclosure of personal data that can directly identify users (e.g., names or addresses) or private information that directly does not identify users but that they do not want to share (e.g., users' preferences or online activities). We propose a system that protects personal data and private information on web browsers from being viewed by others. The system automatically takes screenshots of the web-browser window and detects personal data and private information from the images. The system then obfuscates the detected area with blocking or blurring, and displays it as a duplicated window. We present an experiment on a model that detects personal data and private information on web browsers to implement our system. We also introduce several features to improve user experience."
UIST,2024,3. Break Q&A: New Vizualizations,EVE: Enabling Anyone to Train Robots using Augmented Reality,doi.org/10.1145/3654777.3676413,"Jun Wang, Chun-Cheng Chang, Jiafei Duan, Dieter Fox, Ranjay Krishna","The increasing affordability of robot hardware is accelerating the integration of robots into everyday activities. However, training a robot to automate a task requires expensive trajectory data where a trained human annotator moves a physical robot to train it. Consequently, only those with access to robots produce demonstrations to train robots. In this work, we remove this restriction with EVE, an iOS app that enables everyday users to train robots using intuitive augmented reality visualizations, without needing a physical robot. With EVE, users can collect demonstrations by specifying waypoints with their hands, visually inspecting the environment for obstacles, modifying existing waypoints, and verifying collected trajectories. In a user study (N=14, D=30) consisting of three common tabletop tasks, EVE outperformed three state-of-the-art interfaces in success rate and was comparable to kinesthetic teaching—physically moving a physical robot—in completion time, usability, motion intent communication, enjoyment, and preference (mean of p=0.30). EVE allows users to train robots for personalized tasks, such as sorting desk supplies, organizing ingredients, or setting up board games. We conclude by enumerating limitations and design considerations for future AR-based demonstration collection systems for robotics."
UIST,2024,Demos,"Demonstration of Wheeler: A Three-Wheeled Input Device for Usable, Efficient, and Versatile Non-Visual Interaction",doi.org/10.1145/3672539.3686749,"Md Touhidul Islam, Noushad Sojib, Imran Kabir, Ashiqur Rahman Amit, Mohammad Ruhul Amin, Syed Masum Billah","Navigating multi-level menus with complex hierarchies remains a big challenge for blind and low-vision users, who predominantly use screen readers to interact with computers. To that end, we demonstrate Wheeler, a three-wheeled input device with two side buttons that can speed up complex multi-level hierarchy navigation in common applications. When in operation, the three wheels of Wheeler are each mapped to a different level in the application hierarchy. Each level can be independently traversed using its designated wheel, allowing users to navigate through multiple levels efficiently. Wheeler's three wheels can also be repurposed for other tasks such as 2D cursor manipulation. In this demonstration, we describe the different operation modes and usage of Wheeler."
UIST,2024,1. Break Q&A: New realities,Pro-Tact: Hierarchical Synthesis of Proprioception and Tactile Exploration for Eyes-Free Ray Pointing on Out-of-View VR Menus,doi.org/10.1145/3654777.3676324,"Yeonsu Kim, Jisu Yim, Kyunghwan Kim, Yohan Yun, Geehyuk Lee","We introduce Pro-Tact, a novel eyes-free pointing technique for interacting with out-of-view (OoV) VR menus. This technique combines rapid rough pointing using proprioception with fine-grain adjustments through tactile exploration, enabling menu interaction without visual attention. Our user study demonstrated that Pro-Tact allows users to select menu items accurately (95% accuracy for 54 items) in an eyes-free manner, with reduced fatigue and sickness compared to eyes-engaged interaction. Additionally, we observed that participants voluntarily interacted with OoV menus eyes-free when Pro-Tact's tactile feedback was provided in practical VR application usage contexts. This research contributes by introducing the novel interaction technique, Pro-Tact, and quantitatively evaluating its benefits in terms of performance, user experience, and user preference in OoV menu interactions."
UIST,2024,3. Break Q&A: Storytime,An Interactive System for Suporting Creative Exploration of Cinematic Composition Designs,doi.org/10.1145/3654777.3676393,"Rui He, Huaxin Wei, Ying Cao","Designing cinematic compositions, which involves moving cameras through a scene, is essential yet challenging in filmmaking. Machinima filmmaking provides real-time virtual environments for exploring different compositions flexibly and efficiently. However, producing high-quality cinematic compositions in such environments still requires significant cinematography skills and creativity. This paper presents Cinemassist, a tool designed to support and enhance this creative process by generating a variety of cinematic composition proposals at both keyframe and scene levels, which users can incorporate into their workflows and achieve more creative results. At the crux of our system is a deep generative model trained on real movie data, which can generate plausible, diverse camera poses conditioned on 3D animations and additional input semantics. Our model enables an interactive cinematic composition design workflow where users can co-design with the model by being inspired by model-generated suggestions while having control over the generation process. Our user study and expert rating find Cinemassist can facilitate the design process for users of different backgrounds and enhance the design quality especially for users with animation expertise, demonstrating its potential as an invaluable tool in the context of digital filmmaking."
UIST,2024,Demos,HoloChemie - Sustainable Fabrication of Soft Biochemical Holographic devices for Ubiquitous Sensing,https://scholar.google.com/scholar?hl=en&as_sdt=0%2C10&q=HoloChemie+-+Sustainable+Fabrication+of+Soft+Biochemical+Holographic+devices+for+Ubiquitous+Sensing,"Sutirtha Roy, Moshfiq-Us-Saleheen Chowdhury, Jurjaan Onayza Noim, Richa Pandey, Aditya Shekhar Nittala","Sustainable fabrication approaches and biomaterials are increasingly being used in HCI for fabricating interactive devices. However, thus far majority of the work has focused on integrating electronics. This paper takes a biochemical approach to explore sustainable fabrication approaches for creating biological and environmental sensing devices.  Firstly, we contribute a set of biochemical formulations for biological and environmental sensing which are compatible with bio-sourced and environment-friendly substrate materials. Our formulations are based on a combination of enzymes derived from bacteria and fungi, plant extracts and commercially available chemicals to sense both liquid and gaseous analytes: glucose, lactic acid, pH levels and carbon dioxide. Our novel holographic sensing scheme not only allows for the detection of the presence of analytes but also enables quantitative estimation of the analyte levels. We present a set of application scenarios that demonstrate the versatility of our approach and discuss the sustainability aspects, its limitations, and the implications for bio-chemical systems in HCI."
UIST,2024,Demos,Demo of PortaChrome: A Portable Contact Light Source for Integrated Re-Programmable Multi-Color Textures,doi.org/10.1145/3672539.3686774,"Yunyi Zhu, Cedric Honnet, Yixiao Kang, Junyi Zhu, Angelina J Zheng, Kyle Heinz, Grace Tang, Luca Musk, Michael Wessely, Stefanie Mueller","In this demo, we present PortaChrome, a portable light source that can be attached to everyday objects to reprogram the color of surfaces in contact with them. When PortaChrome makes contact with objects that were previously coated with photochromic dyes, the UV and RGBs LEDs inside PortaChrome create multi-color textures on the objects. In contrast to prior work, which used projectors for the color-change, PortaChrome has a thin and flexible form factor, which allows the color-change process to be integrated into daily user interactions. Because of the close distance between the light source and the photochromic object, PortaChrome creates color textures in less than 4 minutes on average, which is 8 times faster than prior work. We demonstrate PortaChrome with four application examples, including data visualizations on textiles and personalized wearables."
UIST,2024,Demos,Demonstration of WorldScribe: Towards Context-Aware Live Visual Descriptions,https://scholar.google.com/scholar?hl=en&as_sdt=0%2C10&q=Demonstration+of+WorldScribe%3A+Towards+Context-Aware+Live+Visual+Descriptions,"Ruei-Che Chang, Yuxuan Liu, Anhong Guo","Automated live visual descriptions can aid blind people in understanding their surroundings with autonomy and independence. However, providing descriptions that are rich, contextual, and just-in-time has been a long-standing challenge in accessibility. In this work, we develop WorldScribe, a system that generates automated live real-world visual descriptions that are customizable and adaptive to users’ contexts: (i) WorldScribe’s descriptions are tailored to users’ intents and prioritized based on semantic relevance. (ii) WorldScribe is adaptive to visual contexts, e.g., providing consecutively succinct descriptions for dynamic scenes, while presenting longer and detailed ones for stable settings. (iii) WorldScribe is adaptive to sound contexts, e.g., increasing volume in noisy environments, or pausing when conversations start. Powered by a suite of vision, language, and sound recognition models, WorldScribe introduces a description generation pipeline that balances the tradeoffs between their richness and latency to support real-time use. The design of WorldScribe is informed by prior work on providing visual descriptions and a formative study with blind participants. Our user study and subsequent pipeline evaluation show that WorldScribe can provide real-time and fairly accurate visual descriptions to facilitate environment understanding that is adaptive and customized to users’ contexts. Finally, we discuss the implications and further steps toward making live visual descriptions more context-aware and humanized."
UIST,2024,Demos,Interactive Demo: Facilitating the Parametric Definition of Geometric Properties in Programming-Based CAD,https://scholar.google.com/scholar?hl=en&as_sdt=0%2C10&q=Interactive+Demo%3A+Facilitating+the+Parametric+Definition+of+Geometric+Properties+in+Programming-Based+CAD,"J Felipe Gonzalez Avila, Thomas Pietrzak, Audrey Girouard, Géry Casiez","Creating parametric designs in programming-based CAD applications poses significant challenges due to the need for complex programming and arithmetic expressions to define geometric properties and link object attributes. To address this, we present a solution implemented in the CAD application OpenSCAD that enables the retrieval of parametric expressions directly from visual representations, streamlining the design process. Our approach extends the abstract definition of Constructive Solid Geometry (CSG) by incorporating handles, allowing users to target specific parts of geometries. It also facilitates users in extracting parametric definitions for part positions by interacting with visual elements and reusing them in code to define new elements' dimensions or positions. Specifically, users can extract the position of a handle or the delta vector between two handles, facilitating precise parametric movement and alignment. This proof-of-concept demonstrates the potential of these interactions for extending to other attributes, such as orientation or semantic information, thereby improving interactivity and facilitating the design of parametric models in programming-based CAD applications."
UIST,2024,1. Break Q&A: Future Fabrics,What's in a cable? Abstracting Knitting Design Elements with Blended Raster/Vector Primitives,doi.org/10.1145/3654777.3676351,"Hannah Twigg-Smith, Yuecheng Peng, Emily Whiting, Nadya Peek","In chart-based programming environments for machine knitting, patterns are specified at a low level by placing operations on a grid. This highly manual workflow makes it challenging to iterate on design elements such as cables, colorwork, and texture. While vector-based abstractions for knitting design elements may facilitate higher-level manipulation, they often include interdependencies which require stitch-level reconciliation. To address this, we contribute a new way of specifying knits with blended vector and raster primitives. Our abstraction supports the design of interdependent elements like colorwork and texture. We have implemented our blended raster/vector specification in a direct manipulation design tool where primitives are layered and rasterized, allowing for simulation of the resulting knit structure and generation of machine instructions. Through examples, we show how our approach enables higher-level manipulation of various knitting techniques, including intarsia colorwork, short rows, and cables. Specifically, we show how our tool supports the design of complex patterns including origami pleat patterns and capacitive sensor patches."
UIST,2024,2. Break Q&A: Shared Spaces,MyWebstrates: Webstrates as Local-first Software,doi.org/10.1145/3654777.3676445,"Clemens Nylandsted Klokmose, James R. Eagan, Peter van Hardenberg","Webstrates are web substrates, a practical realization of shareable dynamic media under which distributability, shareability, and malleability are fundamental software principles. Webstrates blur the distinction between application and document in a way that enables users to share, repurpose, and refit software across a variety of domains, but its reliance on a central server constrains its use; it is at odds with personal and collective control of data; and limits applications to the web. We extend the fundamental principles to include interoperability and sovereignty over data and propose MyWebstrates, an implementation of Webstrates on top of a new, lower-level substrate for synchronization built around local-first software principles. MyWebstrates registers itself in the user’s browser and function as a piece of local software that can selectively synchronise data over sync servers or peer-to-peer connections. We show how MyWebstrates extends Webstrates to enable offline collaborative use, interoperate between Webstrates on non-web technologies such as Unity, and maintain personal and collective sovereignty over data. We demonstrate how this enables new types of applications of Webstrates and discuss limitations of this approach and new challenges that it reveals."
UIST,2024,Demos,Demonstration of ProgramAlly: Creating Custom Visual Access Programs via Multi-Modal End-User Programming,https://scholar.google.com/scholar?hl=en&as_sdt=0%2C10&q=Demonstration+of+ProgramAlly%3A+Creating+Custom+Visual+Access+Programs+via+Multi-Modal+End-User+Programming,"Jaylin Herskovitz, Andi Xu, Rahaf Alharbi, Anhong Guo","Existing visual assistive technologies are built for simple and common use cases, and have few avenues for blind people to customize their functionalities. Drawing from prior work on DIY assistive technology, this paper investigates end-user programming as a means for users to create and customize visual access programs to meet their unique needs. We introduce ProgramAlly, a system for creating custom filters for visual information, e.g., `find NUMBER on BUS', leveraging three end-user programming approaches: block programming, natural language, and programming by example. To implement ProgramAlly, we designed a representation of visual filtering tasks based on scenarios encountered by blind people, and integrated a set of on-device and cloud models for generating and running these programs. In user studies with 12 blind adults, we found that participants preferred different programming modalities depending on the task, and envisioned using visual access programs to address unique accessibility challenges that are otherwise difficult with existing applications. Through ProgramAlly, we present an exploration of how blind end-users can create visual access programs to customize and control their experiences."
UIST,2024,1. Break Q&A: Future Fabrics,"Flexmock: Fast, easy, stockable smocking method using 3D printed self-shrinkable pattern sheet",doi.org/10.1145/3672539.3686335,"Ami Takahashi, Yu Soma, Karin Tomonaga, Hiroki Sato","In this study, we propose Flexmock, a fabrication method that enables users to easily generate smocking patterns onto cloth by shrinking attachment sheets with geometric patterns. The proposed method offers the following advantages: (1) creating smocking patterns parametrically using design software and simulating the finished product; (2) automatically generating and exporting data for self-shrinking attachments; and (3) quickly applying smocking patterns to fabrics via attached 3D printed pattern sheets. "
UIST,2024,Demos,Demonstrating DrawTalking: Building Interactive Worlds by Sketching and Speaking,https://scholar.google.com/scholar?hl=en&as_sdt=0%2C10&q=Demonstrating+DrawTalking%3A+Building+Interactive+Worlds+by+Sketching+and+Speaking,"Karl Toby Rosenberg, Rubaiat Habib Kazi, Li-Yi Wei, Haijun Xia, Ken Perlin","    We introduce DrawTalking, an approach to building and controlling interactive worlds by sketching and speaking during storytelling. It emphasizes user control and flexibility, and gives programming-like capability without requiring code. We demonstrate the prototype and invite guests to interact with it live."
UIST,2024,3. Break Q&A: Machine Learning for User Interfaces,VisionTasker: Mobile Task Automation Using Vision Based UI Understanding and LLM Task Planning,doi.org/10.1145/3654777.3676386,"Yunpeng Song, Yiheng Bian, Yongtao Tang, Guiyu Ma, Zhongmin Cai","Mobile task automation is an emerging field that leverages AI to streamline and optimize the execution of routine tasks on mobile devices, thereby enhancing efficiency and productivity. Traditional methods, such as Programming By Demonstration (PBD), are limited due to their dependence on predefined tasks and susceptibility to app updates. Recent advancements have utilized the view hierarchy to collect UI information and employed Large Language Models (LLM) to enhance task automation. However, view hierarchies have accessibility issues and face potential problems like missing object descriptions or misaligned structures. This paper introduces VisionTasker, a two-stage framework combining vision-based UI understanding and LLM task planning, for mobile task automation in a step-by-step manner. VisionTasker firstly converts a UI screenshot into natural language interpretations using a vision-based UI understanding approach, eliminating the need for view hierarchies. Secondly, it adopts a step-by-step task planning method, presenting one interface at a time to the LLM. The LLM then identifies relevant elements within the interface and determines the next action, enhancing accuracy and practicality. Extensive experiments show that VisionTasker outperforms previous methods, providing effective UI representations across four datasets. Additionally, in automating 147 real-world tasks on an Android smartphone, VisionTasker demonstrates advantages over humans in tasks where humans show unfamiliarity and shows significant improvements when integrated with the PBD mechanism. VisionTasker is open-source and available at https://github.com/AkimotoAyako/VisionTasker."
UIST,2024,2. Break Q&A: Future of Typing,TouchInsight: Uncertainty-aware Rapid Touch and Text Input for Mixed Reality from Egocentric Vision,doi.org/10.1145/3654777.3676330,"Paul Streli, Mark Richardson, Fadi Botros, Shugao Ma, Robert Wang, Christian Holz","While passive surfaces offer numerous benefits for interaction in mixed reality, reliably detecting touch input solely from head-mounted cameras has been a long-standing challenge. Camera specifics, hand self-occlusion, and rapid movements of both head and fingers introduce considerable uncertainty about the exact location of touch events. Existing methods have thus not been capable of achieving the performance needed for robust interaction. In this paper, we present a real-time pipeline that detects touch input from all ten fingers on any physical surface, purely based on egocentric hand tracking. Our method TouchInsight comprises a neural network to predict the moment of a touch event, the finger making contact, and the touch location. TouchInsight represents locations through a bivariate Gaussian distribution to account for uncertainties due to sensing inaccuracies, which we resolve through contextual priors to accurately infer intended user input. We first evaluated our method offline and found that it locates input events with a mean error of 6.3 mm, and accurately detects touch events (F1=0.99) and identifies the finger used (F1=0.96). In an online evaluation, we then demonstrate the effectiveness of our approach for a core application of dexterous touch input: two-handed text entry. In our study, participants typed 37.0 words per minute with an uncorrected error rate of 2.9% on average."
UIST,2024,3. Break Q&A: New Vizualizations,Data Pictorial: Deconstructing Raster Images for Data-Aware Animated Vector Posters,doi.org/10.1145/3672539.3686353,"Tongyu Zhou, Gromit Yeuk-Yin Chan, Shunan Guo, Jane Hoffswell, Chang Xiao, Victor S. Bursztyn, Eunyee Koh","To support data integration into pictorials, we propose Data Pictorial, a pipeline that deconstructs a raster image into SVG objects whose attributes are contextualized in data. This process is achieved by cropping objects of interest using zero-shot detection, converting them into quantized bitmaps, and tracing the results as SVG paths. The technique then provides suggestions for binding the SVG objects and properties with data fields, affording the flexibility to automatically modify and animate the SVG based on the mapping. The resultant data-aware vector hypermedia can be potential candidates for real-time data inspection and personalization, all while maintaining the aesthetic of the original pictorial."
UIST,2024,3. Break Q&A: Programming UI,NotePlayer: Engaging Jupyter Notebooks for Dynamic Presentation of Analytical Processes,doi.org/10.1145/3654777.3676410,"Yang Ouyang, Leixian Shen, Yun Wang, Quan Li","Diverse presentation formats play a pivotal role in effectively conveying code and analytical processes during data analysis. One increasingly popular format is tutorial videos, particularly those based on Jupyter notebooks, which offer an intuitive interpretation of code and vivid explanations of analytical procedures. However, creating such videos requires a diverse skill set and significant manual effort, posing a barrier for many analysts. To bridge this gap, we introduce an innovative tool called NotePlayer, which connects notebook cells to video segments and incorporates a computational engine with language models to streamline video creation and editing. Our aim is to make the process more accessible and efficient for analysts. To inform the design of NotePlayer, we conducted a formative study and performed content analysis on a corpus of 38 Jupyter tutorial videos. This helped us identify key patterns and challenges encountered in existing tutorial videos, guiding the development of NotePlayer. Through a combination of a usage scenario and a user study, we validated the effectiveness of NotePlayer. The results show that the tool streamlines the video creation and facilitates the communication process for data analysts."
UIST,2024,3. Break Q&A: LLM: New applications,SHAPE-IT: Exploring Text-to-Shape-Display for Generative Shape-Changing Behaviors with LLMs,doi.org/10.1145/3654777.3676348,"Wanli Qian, Chenfeng Gao, Anup Sathya, Ryo Suzuki, Ken Nakagaki","This paper introduces text-to-shape-display, a novel approach to generating dynamic shape changes in pin-based shape displays through natural language commands. By leveraging large language models (LLMs) and AI-chaining, our approach allows users to author shape-changing behaviors on demand through text prompts without programming. We describe the foundational aspects necessary for such a system, including the identification of key generative elements (primitive, animation, and interaction) and design requirements to enhance user interaction, based on formative exploration and iterative design processes. Based on these insights, we develop SHAPE-IT, an LLM-based authoring tool for a 24 x 24 shape display, which translates the user's textual command into executable code and allows for quick exploration through a web-based control interface. We evaluate the effectiveness of SHAPE-IT in two ways: 1) performance evaluation and 2) user evaluation (N= 10). The study conclusions highlight the ability to facilitate rapid ideation of a wide range of shape-changing behaviors with AI. However, the findings also expose accuracy-related challenges and limitations, prompting further exploration into refining the framework for leveraging AI to better suit the unique requirements of shape-changing systems."
