conference,year,session name,paper title,DOI,author list,abstract
UIST,2024,2. Break Q&A: Vision-based UIs,Vision-Based Hand Gesture Customization from a Single Demonstration,doi.org/10.1145/3654777.3676378,"Soroush Shahi, Vimal Mollyn, Cori Tymoszek Park, Runchang Kang, Asaf Liberman, Oron Levy, Jun Gong, Abdelkareem Bedri, Gierad Laput","Hand gesture recognition is becoming a more prevalent mode of human-computer interaction, especially as cameras proliferate across everyday devices. Despite continued progress in this field, gesture customization is often underexplored. Customization is crucial since it enables users to define and demonstrate gestures that are more natural, memorable, and accessible. However, customization requires efficient usage of user-provided data. We introduce a method that enables users to easily design bespoke gestures with a monocular camera from one demonstration. We employ transformers and meta-learning techniques to address few-shot learning challenges. Unlike prior work, our method supports any combination of one-handed, two-handed, static, and dynamic gestures, including different viewpoints, and the ability to handle irrelevant hand movements. We implement three real-world applications using our customization method, conduct a user study, and achieve up to 94\% average recognition accuracy from one demonstration. Our work provides a viable path for vision-based gesture customization, laying the foundation for future advancements in this domain. "
UIST,2024,1. Break Q&A: Bodily Signals,Empower Real-World BCIs with NIRS-X: An Adaptive Learning Framework that Harnesses Unlabeled Brain Signals,doi.org/10.1145/3654777.3676429,"Liang Wang, Jiayan Zhang, Jinyang Liu, Devon McKeon, David Guy Brizan, Giles Blaney, Robert J.K Jacob","Brain-Computer Interfaces (BCIs) using functional near-infrared spectroscopy (fNIRS) hold promise for future interactive user interfaces due to their ease of deployment and declining cost. However, they typically require a separate calibration process for each user and task, which can be burdensome. Machine learning helps, but faces a data scarcity problem. Due to inherent inter-user variations in physiological data, it has been typical to create a new annotated training dataset for every new task and user. To reduce dependence on such extensive data collection and labeling, we present an adaptive learning framework, NIRS-X, to harness more easily accessible unlabeled fNIRS data.  NIRS-X includes two key components: NIRSiam and NIRSformer. We use the NIRSiam algorithm to extract generalized brain activity representations from unlabeled fNIRS data obtained from previous users and tasks, and then transfer that knowledge to new users and tasks. In conjunction, we design a neural network, NIRSformer, tailored for capturing both local and global, spatial and temporal relationships in multi-channel fNIRS brain input signals. By using unlabeled data from both a previously released fNIRS2MW visual $n$-back dataset and a newly collected fNIRS2MW audio $n$-back dataset, NIRS-X demonstrates its strong adaptation capability to new users and tasks. Results show comparable or superior performance to supervised methods, making NIRS-X promising for real-world fNIRS-based BCIs."
UIST,2024,2. Break Q&A: Contextual Augmentations,WorldScribe: Towards Context-Aware Live Visual Descriptions,doi.org/10.1145/3654777.3676375,"Ruei-Che Chang, Yuxuan Liu, Anhong Guo","Automated live visual descriptions can aid blind people in understanding their surroundings with autonomy and independence. However, providing descriptions that are rich, contextual, and just-in-time has been a long-standing challenge in accessibility. In this work, we develop WorldScribe, a system that generates automated live real-world visual descriptions that are customizable and adaptive to users' contexts: (i) WorldScribe's descriptions are tailored to users' intents and prioritized based on semantic relevance. (ii) WorldScribe is adaptive to visual contexts, e.g., providing consecutively succinct descriptions for dynamic scenes, while presenting longer and detailed ones for stable settings. (iii) WorldScribe is adaptive to sound contexts, e.g., increasing volume in noisy environments, or pausing when conversations start. Powered by a suite of vision, language, and sound recognition models, WorldScribe introduces a description generation pipeline that balances the tradeoffs between their richness and latency to support real-time use. The design of WorldScribe is informed by prior work on providing visual descriptions and a formative study with blind participants. Our user study and subsequent pipeline evaluation show that WorldScribe can provide real-time and fairly accurate visual descriptions to facilitate environment understanding that is adaptive and customized to users' contexts. Finally, we discuss the implications and further steps toward making live visual descriptions more context-aware and humanized."
UIST,2024,1. Break Q&A: Bodily Signals,Understanding the Effects of Restraining Finger Coactivation in Mid-Air Typing: from a Neuromechanical Perspective,doi.org/10.1145/3654777.3676441,"Hechuan Zhang, Xuewei Liang, Ying Lei, Yanjun Chen, Zhenxuan He, Yu Zhang, Lihan Chen, Hongnan Lin, Teng Han, Feng Tian","Typing in mid-air is often perceived as intuitive yet presents challenges due to finger coactivation, a neuromechanical phenomenon that involves involuntary finger movements stemming from the lack of physical constraints. Previous studies were used to examine and address the impacts of finger coactivation using algorithmic approaches. Alternatively, this paper explores the neuromechanical effects of finger coactivation on mid-air typing, aiming to deepen our understanding and provide valuable insights to improve these interactions. We utilized a wearable device that restrains finger coactivation as a prop to conduct two mid-air studies, including a rapid finger-tapping task and a ten-finger typing task. The results revealed that restraining coactivation not only reduced mispresses, which is a classic coactivated error always considered as harm caused by coactivation. Unexpectedly, the reduction of motor control errors and spelling errors, thinking as non-coactivated errors, also be observed. Additionally, the study evaluated the neural resources involved in motor execution using functional Near Infrared Spectroscopy (fNIRS), which tracked cortical arousal during mid-air typing. The findings demonstrated decreased activation in the primary motor cortex of the left hemisphere when coactivation was restrained, suggesting a diminished motor execution load. This reduction suggests that a portion of neural resources is conserved, which also potentially aligns with perceived lower mental workload and decreased frustration levels."
UIST,2024,1. Break Q&A: Future Fabrics,Stretchy Embroidered Circuits,doi.org/10.1145/3672539.3686343,"Josef Macera, Soma Narita, Lea Albaugh","We introduce a preliminary system which generates machine embroidery patterns for electronic circuits on stretchy fabrics. Our system incorporates parametric stretch-optimized embroidery paths, and we offer tips for e-textile embroidery on stretch fabrics."
UIST,2024,3. Break Q&A: Programming UI,"MicroCode: Live, Portable Programming for Children via Robotics",https://scholar.google.com/scholar?hl=en&as_sdt=0%2C10&q=MicroCode%3A+Live%2C+Portable+Programming+for+Children+via+Robotics,"Lorraine Underwood, Thomas J Ball, Steve Hodges, Elisa Rubegni, Peli de Halleux, Joe Finney","The BBC micro:bit is a popular tool in education for teaching coding, but typically requires a host computer and internet access, limiting its accessibility. MicroCode addresses this by enabling portable programming directly on the micro:bit using a battery-powered accessory with an OLED screen and navigation buttons. This system utilises a simple, handheld graphical tile-based programming paradigm, yet supports complex programs with features including conditional execution and variables, providing immediate feedback through live programming. This paper illustrates how early studies have received a positive reception from children and educators, especially when paired with robotics as an application domain. Plans for future work aim to extend the reach of Microcode by providing more tangible digital learning opportunities to pre-literate children and communities around the world where access to mains power and internet are scarce."
UIST,2024,1. Break Q&A: FABulous,Understanding and Supporting Debugging Workflows in CAD,doi.org/10.1145/3654777.3676353,"Felix Hähnlein, Gilbert Bernstein, Adriana Schulz","One of the core promises of parametric Computer-Aided Design (CAD) is that users can easily edit their model at any point in time. However, due to the ambiguity of changing references to intermediate, updated geometry, parametric edits can lead to reference errors which are difficult to fix in practice. We claim that debugging reference errors remains challenging because CAD systems do not provide users with tools to understand where the error happened and how to fix it. To address these challenges, we prototype a graphical debugging tool, DeCAD, which helps comparing CAD model states both across operations and across edits. In a qualitative lab study, we use DeCAD as a probe to understand specific challenges that users face and what workflows they employ to overcome them. We conclude with design implications for future debugging tool developers.  "
UIST,2024,1. Break Q&A: New realities,FisheyeVR: Extending the Field of View by Dynamic Zooming in Virtual Reality,https://scholar.google.com/scholar?hl=en&as_sdt=0%2C10&q=FisheyeVR%3A+Extending+the+Field+of+View+by+Dynamic+Zooming+in+Virtual+Reality,"De-Yuan Lu, Lung-Pan Cheng","We propose FisheyeVR, a zooming interface in VR dynamically providing users a larger software FOV by zooming out to a shorter virtual focal length, trading in an acceptable visual distortion for more context. We conduct studies to (1) understand the visual distortion of zoom-out FOVs, (2) test 4 triggering methods with common VR scenarios and (3) evaluate the integrated FisheyeVR system. Our findings demonstrate that FisheyeVR not only significantly reduces users' physical effort and oculomotor simulator sickness but also maintains performance levels, accompanied by positive feedback."
UIST,2024,2. Break Q&A: Vision-based UIs,Digital Phenotyping based on a Mobile App Identifies Distinct and Overlapping Features in Children Diagnosed with Autism versus ADHD,doi.org/10.1145/3672539.3686323,"Vikram Aikat, Pradeep Raj Krishnappa Babu, Kimberly L.H. Carpenter, J. Matias Di Martino, Steven Espinosa, Naomi Davis, Lauren Franz, Marina Spanos, Geraldine Dawson, Guillermo Sapiro","The high prevalence of autism calls for accessible and scalable technology-assisted screening tools. This will aid in early detection allowing timely access to services and supports. SenseToKnow, a mobile digital phenotyping app, showed potential in eliciting autism-related behaviors that can be automatically captured via computer vision analysis (CVA) in toddlers. Here, we present the capability of SenseToKnow in characterizing autism in school age children and showcase the robustness of the CVA features in interpreting distinct and overlapping behaviors with attention-deficit/hyperactive disorder (ADHD)."
UIST,2024,3. Break Q&A: Learning to Learn,Transforming Procedural Instructions into In-Situ Augmented Reality Guides with InstructAR,https://scholar.google.com/scholar?hl=en&as_sdt=0%2C10&q=Transforming+Procedural+Instructions+into+In-Situ+Augmented+Reality+Guides+with+InstructAR,"Panayu Keelawat, Ryo Suzuki","Following manual procedural instructions can often be frustrating due to the mental gap between the instructions and their real-world application. Variations in settings can further compound this confusion for those attempting to follow them. To address this problem, we propose InstructAR, a system under development that bridges textual instructions with the real world through Augmented Reality (AR) guides. With this tool, users can easily follow clear and actionable step-by-step instructions, as related objects are highlighted and AR guides indicate necessary actions. InstructAR also provides feedback upon task completion. This proof-of-concept leverages Natural Language Processing and Computer Vision techniques. Our work aims to reduce cognitive load and errors, making it easier for users to follow manual procedural instructions accurately."
UIST,2024,Doctoral Symposium (Not Public),Physical and Social Adaptation for Assistive Robot Interactions,doi.org/10.1145/3672539.3686713,Nathaniel Steele Dennler,"Robots have the potential to provide users with limited mobility additional ways of interacting with the world around them. However, each user has preferences for how they interact with these physical interfaces. My dissertation research develops tools and algorithms to allow robot interactions to adapt to the individual needs of users. In particular, I develop ways to adapt a robot's design, physical movements, and social behaviors. By adapting robots to users I hope to develop systems that more holistically aid users with limited mobility."
UIST,2024,3. Break Q&A: Storytime,Game Jam with CARDinality: A Case Study of Exploring Play-based Interactive Applications,https://scholar.google.com/scholar?hl=en&as_sdt=0%2C10&q=Game+Jam+with+CARDinality%3A+A+Case+Study+of+Exploring+Play-based+Interactive+Applications,"Emilie Faracci, Aditya Retnanto, Anup Sathya, Ashlyn Sparrow, Ken Nakagaki","This paper delves into a Game Jam, a workshop-based investigation widespread in the game design community, to explore the potential and applications of CARDinality, a card-shaped robotic device, giving insights into the material implications and prototyping potential of this novel platform. During the Game Jam, 9 participants were informed of basic game design principles and techniques from a game design researcher. They then interacted with our hardware devices to brainstorm future card games supported by CARDinality, revealing a breadth of unique applications anchored in 'play.'"
UIST,2024,3. Break Q&A: Machine Learning for User Interfaces,UIClip: A Data-driven Model for Assessing User Interface Design,doi.org/10.1145/3654777.3676408,"Jason Wu, Yi-Hao Peng, Xin Yue Amanda Li, Amanda Swearngin, Jeffrey P Bigham, Jeffrey Nichols","User interface (UI) design is a difficult yet important task for ensuring the usability, accessibility, and aesthetic qualities of applications. In our paper, we develop a machine-learned model, UIClip, for assessing the design quality and visual relevance of a UI given its screenshot and natural language description. To train UIClip, we used a combination of automated crawling, synthetic augmentation, and human ratings to construct a large-scale dataset of UIs, collated by description and ranked by design quality. Through training on the dataset, UIClip implicitly learns properties of good and bad designs by (i) assigning a numerical score that represents a UI design's relevance and quality and (ii) providing design suggestions. In an evaluation that compared the outputs of UIClip and other baselines to UIs rated by 12 human designers, we found that UIClip achieved the highest agreement with ground-truth rankings. Finally, we present three example applications that demonstrate how UIClip can facilitate downstream applications that rely on instantaneous assessment of UI design quality: (i) UI code generation, (ii) UI design tips generation, and (iii) quality-aware UI example search."
UIST,2024,3. Break Q&A: Programming UI,SQLucid: Grounding Natural Language Database Queries with Interactive Explanations,doi.org/10.1145/3654777.3676368,"Yuan Tian, Jonathan K. Kummerfeld, Toby Jia-Jun Li, Tianyi Zhang","Though recent advances in machine learning have led to significant improvements in natural language interfaces for databases, the accuracy and reliability of these systems remain limited, especially in high-stakes domains. This paper introduces SQLucid, a novel user interface that bridges the gap between non-expert users and complex database querying processes. SQLucid addresses existing limitations by integrating visual correspondence, intermediate query results, and editable step-by-step SQL explanations in natural language to facilitate user understanding and engagement. This unique blend of features empowers users to understand and refine SQL queries easily and precisely. Two user studies and one quantitative experiment were conducted to validate SQLucid’s effectiveness, showing significant improvement in task completion accuracy and user confidence compared to existing interfaces. Our code is available at https://github.com/magic-YuanTian/SQLucid."
UIST,2024,2. Break Q&A: Sound & Music,Auptimize: Optimal Placement of Spatial Audio Cues for Extended Reality,doi.org/10.1145/3654777.3676424,"Hyunsung Cho, Alexander Wang, Divya Kartik, Emily Liying Xie, Yukang Yan, David Lindlbauer","Spatial audio in Extended Reality (XR) provides users with better awareness of where virtual elements are placed, and efficiently guides them to events such as notifications, system alerts from different windows, or approaching avatars. Humans, however, are inaccurate in localizing sound cues, especially with multiple sources due to limitations in human auditory perception such as angular discrimination error and front-back confusion. This decreases the efficiency of XR interfaces because users misidentify from which XR element a sound is coming. To address this, we propose Auptimize, a novel computational approach for placing XR sound sources, which mitigates such localization errors by utilizing the ventriloquist effect. Auptimize disentangles the sound source locations from the visual elements and relocates the sound sources to optimal positions for unambiguous identification of sound cues, avoiding errors due to inter-source proximity and front-back confusion. Our evaluation shows that Auptimize decreases spatial audio-based source identification errors compared to playing sound cues at the paired visual-sound locations. We demonstrate the applicability of Auptimize for diverse spatial audio-based interactive XR scenarios."
UIST,2024,2. Break Q&A: Contextual Augmentations,DesignChecker: Visual Design Support for Blind and Low Vision Web Developers,doi.org/10.1145/3654777.3676369,"Mina Huh, Amy Pavel","Blind and low vision (BLV) developers create websites to share knowledge and showcase their work. A well-designed website can engage audiences and deliver information effectively, yet it remains challenging for BLV developers to review their web designs. We conducted interviews with BLV developers (N=9) and analyzed 20 websites created by BLV developers. BLV developers created highly accessible websites but wanted to assess the usability of their websites for sighted users and follow the design standards of other websites. They also encountered challenges using screen readers to identify illegible text, misaligned elements, and inharmonious colors. We present DesignChecker, a browser extension that helps BLV developers improve their web designs. With DesignChecker, users can assess their current design by comparing it to visual design guidelines, a reference website of their choice, or a set of similar websites. DesignChecker also identifies the specific HTML elements that violate design guidelines and suggests CSS changes for improvements. Our user study participants (N=8) recognized more visual design errors than using their typical workflow and expressed enthusiasm about using DesignChecker in the future."
UIST,2024,3. Break Q&A: Validation in AI/ML,Who Validates the Validators? Aligning LLM-Assisted Evaluation of LLM Outputs with Human Preferences,doi.org/10.1145/3654777.3676450,"Shreya Shankar, J.D. Zamfirescu-Pereira, Bjoern Hartmann, Aditya Parameswaran, Ian Arawjo","Due to the cumbersome nature of human evaluation and limitations of code-based evaluation, Large Language Models (LLMs) are increasingly being used to assist humans in evaluating LLM outputs. Yet LLM-generated evaluators simply inherit all the problems of the LLMs they evaluate, requiring further human validation. We present a mixed-initiative approach to “validate the validators”— aligning LLM-generated evaluation functions (be it prompts or code) with human requirements. Our interface, EvalGen, provides automated assistance to users in generating evaluation criteria and implementing assertions. While generating candidate implementations (Python functions, LLM grader prompts), EvalGen asks humans to grade a subset of LLM outputs; this feedback is used to select implementations that better align with user grades. A qualitative study finds overall support for EvalGen but underscores the subjectivity and iterative nature of alignment. In particular, we identify a phenomenon we dub criteria drift: users need criteria to grade outputs, but grading outputs helps users define criteria. What is more, some criteria appear dependent on the specific LLM outputs observed (rather than independent and definable a priori), raising serious questions for approaches that assume the independence of evaluation from observation of model outputs. We present our interface and implementation details, a comparison of our algorithm with a baseline approach, and implications for the design of future LLM evaluation assistants."
UIST,2024,2. Break Q&A: Sound & Music,Towards Music-Aware Virtual Assistants,doi.org/10.1145/3654777.3676416,"Alexander Wang, David Lindlbauer, Chris Donahue","We propose a system for modifying spoken notifications in a manner that is sensitive to the music a user is listening to. Spoken notifications provide convenient access to rich information without the need for a screen. Virtual assistants see prevalent use in hands-free settings such as driving or exercising, activities where users also regularly enjoy listening to music. In such settings, virtual assistants will temporarily mute a user's music to improve intelligibility. However, users may perceive these interruptions as intrusive, negatively impacting their music-listening experience. To address this challenge, we propose the concept of music-aware virtual assistants, where speech notifications are modified to resemble a voice singing in harmony with the user's music. We contribute a system that processes user music and notification text to produce a blended mix, replacing original song lyrics with the notification content. In a user study comparing musical assistants to standard virtual assistants, participants expressed that musical assistants fit better with music, reduced intrusiveness, and provided a more delightful listening experience overall. "
UIST,2024,2. Break Q&A: Poses as Input,Touchscreen-based Hand Tracking for Remote Whiteboard Interaction,doi.org/10.1145/3654777.3676412,"Xinshuang Liu, Yizhong Zhang, Xin Tong","In whiteboard-based remote communication, the seamless integration of drawn content and hand-screen interactions is essential for an immersive user experience. Previous methods either require bulky device setups for capturing hand gestures or fail to accurately track the hand poses from capacitive images. In this paper, we present a real-time method for precise tracking 3D poses of both hands from capacitive video frames. To this end, we develop a deep neural network to identify hands and infer hand joint positions from capacitive frames, and then recover 3D hand poses from the hand-joint positions via a constrained inverse kinematic solver. Additionally, we design a device setup for capturing high-quality hand-screen interaction data and obtained a more accurate synchronized capacitive video and hand pose dataset. Our method improves the accuracy and stability of 3D hand tracking for capacitive frames while maintaining a compact device setup for remote communication. We validate our scheme design and its superior performance on 3D hand pose tracking and demonstrate the effectiveness of our method in whiteboard-based remote communication. "
UIST,2024,2. Break Q&A: Movement-based UIs,Effects of Computer Mouse Lift-off Distance Settings in Mouse Lifting Action,doi.org/10.1145/3654777.3676442,"Munjeong Kim, Sunjun Kim","This study investigates the effect of Lift-off Distance (LoD) on a computer mouse, which refers to the height at which a mouse sensor stops tracking when lifted off the surface. Although a low LoD is generally preferred to avoid unintentional cursor movement in mouse lifting (=clutching), especially in first-person shooter games, it may reduce tracking stability.  We conducted a psychophysical experiment to measure the perceptible differences between LoD levels and quantitatively measured the unintentional cursor movement error and tracking stability at four levels of LoD while users performed mouse lifting. The results showed a trade-off between movement error and tracking stability at varying levels of LoD. Our findings offer valuable information on optimal LoD settings, which could serve as a guide for choosing a proper mouse device for enthusiastic gamers. "
