conference,year,session name,paper title,DOI,author list,abstract
UIST,2024,2. Break Q&A: Vision-based UIs,VirtualNexus: Enhancing 360-Degree Video AR/VR Collaboration with Environment Cutouts and Virtual Replicas,doi.org/10.1145/3654777.3676377,"Xincheng Huang, Michael Yin, Ziyi Xia, Robert Xiao","Asymmetric AR/VR collaboration systems bring a remote VR user to a local AR user’s physical environment, allowing them to communicate and work within a shared virtual/physical space. Such systems often display the remote environment through 3D reconstructions or 360° videos. While 360° cameras stream an environment in higher quality, they lack spatial information, making them less interactable. We present VirtualNexus, an AR/VR collaboration system that enhances 360° video AR/VR collaboration with environment cutouts and virtual replicas. VR users can define cutouts of the remote environment to interact with as a world-in-miniature, and their interactions are synchronized to the local AR perspective. Furthermore, AR users can rapidly scan and share 3D virtual replicas of physical objects using neural rendering. We demonstrated our system’s utility through 3 example applications and evaluated our system in a dyadic usability test. VirtualNexus extends the interaction space of 360° telepresence systems, offering improved physical presence, versatility, and clarity in interactions. "
UIST,2024,3. Break Q&A: Generating Visuals,AutoSpark: Supporting Automobile Appearance Design Ideation with Kansei Engineering and Generative AI,doi.org/10.1145/3654777.3676337,"Liuqing Chen, Qianzhi Jing, Yixin Tsang, Qianyi Wang, Ruocong Liu, Duowei Xia, Yunzhan Zhou, Lingyun Sun","Rapid creation of novel product appearance designs that align with consumer emotional requirements poses a significant challenge. Text-to-image models, with their excellent image generation capabilities, have demonstrated potential in providing inspiration to designers. However, designers still encounter issues including aligning emotional needs, expressing design intentions, and comprehending generated outcomes in practical applications. To address these challenges, we introduce AutoSpark, an interactive system that integrates Kansei Engineering and generative AI to provide creativity support for designers in creating automobile appearance designs that meet emotional needs. AutoSpark employs a Kansei Engineering engine powered by generative AI and a semantic network to assist designers in emotional need alignment, design intention expression, and prompt crafting. It also facilitates designers' understanding and iteration of generated results through fine-grained image-image similarity comparisons and text-image relevance assessments. The design-thinking map within its interface aids in managing the design process. Our user study indicates that AutoSpark effectively aids designers in producing designs that are more aligned with emotional needs and of higher quality compared to a baseline system, while also enhancing the designers' experience in the human-AI co-creation process."
UIST,2024,2. Break Q&A: Future of Typing,OptiBasePen: Mobile Base+Pen Input on Passive Surfaces by Sensing Relative Base Motion Plus Close-Range Pen Position,doi.org/10.1145/3654777.3676467,"Andreas Rene Fender, Mohamed Kari","Digital pen input devices based on absolute pen position sensing, such as Wacom Pens, support high-fidelity pen input. However, they require specialized sensing surfaces like drawing tablets, which can have a large desk footprint, constrain the possible input area, and limit mobility. In contrast, digital pens with integrated relative sensing enable mobile use on passive surfaces, but suffer from motion artifacts or require surface contact at all times, deviating from natural pen affordances. We present OptiBasePen, a device for mobile pen input on ordinary surfaces. Our prototype consists of two parts: the ""base"" on which the hand rests and the pen for fine-grained input. The base features a high-precision mouse sensor to sense its own relative motion, and two infrared image sensors to track the absolute pen tip position within the base's frame of reference. This enables pen input on ordinary surfaces without external cameras while also avoiding drift from pen micro-movements. In this work, we present our prototype as well as the general base+pen concept, which combines relative and absolute sensing."
UIST,2024,2. Break Q&A: Hot Interfaces,Fiery Hands: Designing Thermal Glove through Thermal and Tactile Integration for Virtual Object Manipulation,doi.org/10.1145/3654777.3676457,"Haokun Wang, Yatharth Singhal, Hyunjae Gil, Jin Ryong Kim","We present a novel approach to render thermal and tactile feedback to the palm and fingertips through thermal and tactile integration. Our approach minimizes the obstruction of the palm and inner side of the fingers and enables virtual object manipulation while providing localized and global thermal feedback. By leveraging thermal actuators positioned strategically on the outer palm and back of the fingers in interplay with tactile actuators, our approach exploits thermal referral and tactile masking phenomena. Through a series of user studies, we validate the perception of localized thermal sensations across the palm and fingers, showcasing the ability to generate diverse thermal patterns. Furthermore, we demonstrate the efficacy of our approach in VR applications,  replicating diverse thermal interactions with virtual objects. This work represents significant progress in thermal interactions within VR, offering enhanced sensory immersion at an optimal energy cost."
UIST,2024,1. Break Q&A: Prototyping,AniCraft: Crafting Everyday Objects as Physical Proxies for Prototyping 3D Character Animation in Mixed Reality,doi.org/10.1145/3654777.3676325,"Boyu Li, Linping Yuan, Zhe Yan, Qianxi Liu, Yulin Shen, Zeyu Wang","We introduce AniCraft, a mixed reality system for prototyping 3D character animation using physical proxies crafted from everyday objects. Unlike existing methods that require specialized equipment to support the use of physical proxies, AniCraft only requires affordable markers, webcams, and daily accessible objects and materials. AniCraft allows creators to prototype character animations through three key stages: selection of virtual characters, fabrication of physical proxies, and manipulation of these proxies to animate the characters. This authoring workflow is underpinned by diverse physical proxies, manipulation types, and mapping strategies, which ease the process of posing virtual characters and mapping user interactions with physical proxies to animated movements of virtual characters. We provide a range of cases and potential applications to demonstrate how diverse physical proxies can inspire user creativity. User experiments show that our system can outperform traditional animation methods for rapid prototyping. Furthermore, we provide insights into the benefits and usage patterns of different materials, which lead to design implications for future research."
UIST,2024,3. Break Q&A: Learning to Learn,Patterns of Hypertext-Augmented Sensemaking,doi.org/10.1145/3654777.3676338,"Siyi Zhu, Robert Haisfield, Brendan Langen, Joel Chan","The early days of HCI were marked by bold visions of hypertext as a transformative medium for augmented sensemaking, exemplified in systems like Memex, Xanadu, and NoteCards. Today, however, hypertext is often disconnected from discussions of the future of sensemaking. In this paper, we investigate how the recent resurgence in hypertext ``tools for thought'' might point to new directions for hypertext-augmented sensemaking. Drawing on detailed analyses of guided tours with 23 scholars, we describe hypertext-augmented use patterns for dealing with the core problem of revisiting and reusing existing/past ideas during scholarly sensemaking. We then discuss how these use patterns validate and extend existing knowledge of hypertext design patterns for sensemaking, and point to new design opportunities for augmented sensemaking."
UIST,2024,3. Break Q&A: Learning to Learn,LessonPlanner: Assisting Novice Teachers to Prepare Pedagogy-Driven Lesson Plans with Large Language Models,doi.org/10.1145/3654777.3676390,"Haoxiang Fan, Guanzheng Chen, Xingbo Wang, Zhenhui Peng","Preparing a lesson plan, e.g., a detailed road map with strategies and materials for instructing a 90-minute class, is beneficial yet challenging for novice teachers. Large language models (LLMs) can ease this process by generating adaptive content for lesson plans, which would otherwise require teachers to create from scratch or search existing resources. In this work, we first conduct a formative study with six novice teachers to understand their needs for support of preparing lesson plans with LLMs. Then, we develop LessonPlanner that assists users to interactively construct lesson plans with adaptive LLM-generated content based on Gagne's nine events. Our within-subjects study (N=12) shows that compared to the baseline ChatGPT interface, LessonPlanner can significantly improve the quality of outcome lesson plans and ease users' workload in the preparation process. Our expert interviews (N=6) further demonstrate LessonPlanner's usefulness in suggesting effective teaching strategies and meaningful educational resources. We discuss concerns on and design considerations for supporting teaching activities with LLMs."
UIST,2024,1. Break Q&A: Prototyping,Seent: Interfacing Gamified Olfactory Training,doi.org/10.1145/3672539.3686356,Ling Qin,"Olfactory dysfunction affects a significant proportion of the global population. Although traditional olfactory training can help with rehabilitation, it often lacks engagement due to its repetitive and dull nature. Advances in digital olfactory technologies have made the interaction between humans and odours possible. We introduce Seent, an interactive interface designed to gamify olfactory training, including hardware to digitalise odours and a corresponding Graphical User Interface. Seent integrates playful gameplay into the training process, allowing participants to engage in a series of odour-based interactive games. This paper concludes by outlining future steps and proposing its potential to enhance olfactory rehabilitation and promote regular olfactory health monitoring."
UIST,2024,2. Break Q&A: Hot Interfaces,Flip-Pelt: Motor-Driven Peltier Elements for Rapid Thermal Stimulation and Congruent Pressure Feedback in Virtual Reality,doi.org/10.1145/3654777.3676363,"Seongjun Kang, Gwangbin Kim, Seokhyun Hwang, Jeongju Park, Ahmed Elsharkawy, SeungJun Kim","This study introduces ""Flip-Pelt,"" a motor-driven peltier device designed to provide rapid thermal stimulation and congruent pressure feedback in virtual reality (VR) environments. Our system incorporates eight motor-driven peltier elements, allowing for the flipping of preheated or cooled elements to the opposite side. In evaluating the Flip-Pelt device, we assess user ability to distinguish between heat/cold sources by their patterns and stiffness, and its impact on enhancing haptic experiences in VR content that involves contact with various thermal sources. Our findings demonstrate that rapid thermal stimulation and congruent pressure feedback provided by Flip-Pelt enhance the recognition accuracy of thermal patterns and the stiffness of virtual objects. These features also improve haptic experiences in VR scenarios through their temporal congruency between tactile and thermal stimuli. Additionally, we discuss the scalability of the Flip-Pelt system to other body parts by proposing design prototypes."
UIST,2024,1. Break Q&A: Prototyping,Mul-O: Encouraging Olfactory Innovation in Various Scenarios Through a Task-Oriented Development Platform,doi.org/10.1145/3654777.3676387,"Peizhong Gao, Fan Liu, Di Wen, Yuze Gao, Linxin Zhang, Chikelei Wang, Qiwei Zhang, Yu Zhang, Shao-en Ma, Qi Lu, Haipeng Mi, YINGQING XU","Olfactory interfaces are pivotal in HCI, yet their development is hindered by limited application scenarios, stifling the discovery of new research opportunities. This challenge primarily stems from existing design tools focusing predominantly on odor display devices and the creation of standalone olfactory experiences, rather than enabling rapid adaptation to various contexts and tasks. Addressing this, we introduce Mul-O, a novel task-oriented development platform crafted to aid semi-professionals in navigating the diverse requirements of potential application scenarios and effectively prototyping ideas. Mul-O facilitates the swift association and integration of olfactory experiences into functional designs, system integrations, and concept validations. Comprising a web UI for task-oriented development, an API server for seamless third-party integration, and wireless olfactory display hardware, Mul-O significantly enhances the ideation and prototyping process in multisensory tasks. This was verified by a 15-day workshop attended by 30 participants. The workshop produced seven innovative projects, underscoring Mul-O's efficacy in fostering olfactory innovation."
UIST,2024,2. Break Q&A: A11y,Accessible Gesture Typing on Smartphones for People with Low Vision,doi.org/10.1145/3654777.3676447,"Dan Zhang, Zhi Li, Vikas Ashok, William H Seiple, IV Ramakrishnan, Xiaojun Bi","While gesture typing is widely adopted on touchscreen keyboards, its support for low vision users is limited.  We have designed and implemented two keyboard prototypes, layout-magnified and key-magnified keyboards, to enable gesture typing for people with low vision. Both keyboards facilitate uninterrupted access to all keys while the screen magnifier is active, allowing people with low vision to input text with one continuous stroke. Furthermore, we have created a kinematics-based decoding algorithm to accommodate the typing behavior of people with low vision. This algorithm can decode the gesture input even if the gesture trace deviates from a pre-defined word template, and the starting position of the gesture is far from the starting letter of the target word. Our user study showed that the key-magnified keyboard achieved 5.28 words per minute, 27.5% faster than a conventional gesture typing keyboard with voice feedback."
UIST,2024,1. Break Q&A: FABulous,Fluxable: A Tool for Making 3D Printable Sensors and Actuators,doi.org/10.1145/3672539.3686342,"Hsuanling Lee, Yujie Shan, Huachao Mao, Liang He","We present Fluxable, a tool for making custom sensors and actuators 3D printable with customer-grade Stereolithography (SLA) 3D printers. With this tool, the user converts an arbitrary 3D model into a deformable body with integrated helix-and-lattice structures, which comprise a hollow helical channel in the center, lattice paddings, and a wireframe structure on the surface. The tool allows for the parameterization of the helix for sensing performance and customization of the lattice for actuation. By inserting a conductive shape-memory alloy (SMA) into a printed object through the helical channel, the converted shape becomes a sensor to detect various shape-changing behaviors using inductive sensing or an actuator to trigger movements through temperature control. We demonstrated our tool with a series of example sensors and actuators, including an interactive timer, a DJ station, and a caterpillar robot."
UIST,2024,2. Break Q&A: Shared Spaces,HoloClass: Enhancing VR Classroom with Live Volumetric Video Streaming,doi.org/10.1145/3672539.3686330,"Yu Liu, Qiao Jin, Zejun Zhang, Bo Han, Svetlana Yarosh, Feng Qian","Virtual Reality (VR) enhances education by creating immersive and engaging learning environments. Volumetric video (VV) further improves VR classrooms by offering realistic, 3D representations of instructors and materials without high development costs. This study introduces HoloClass, a live VV streaming system for VR classrooms. We conducted interviews with 18 students to identify key design needs, resulting in features of HoloClass that support real-time awareness, classroom scalability, and note-taking. Our contributions include empirical insights into designing educational tools with live VV in VR classrooms and the implementation of features that enhance interaction and learning in a virtual setting."
UIST,2024,Doctoral Symposium (Not Public),Enhancing How People Learn Procedural Tasks Through How-to Videos,doi.org/10.1145/3672539.3686711,Saelyne Yang,"Humans learn skills to perform various tasks in their everyday lives. While how-to videos serve as a popular tool for people to learn skills and achieve tasks, there are limitations in learning from videos such as difficulties in accessing information in need or lack of personalized support. My Ph.D. research aims to enhance how people learn procedural tasks through how-to videos by understanding and improving the consumption of video content, application of the content to their own context, and reflection on the experiences. This research presents opportunities and insights into how we could better leverage videos for humans to learn skills and achieve tasks."
UIST,2024,Doctoral Symposium (Not Public),Enabling Safer Augmented Reality Experiences: Usable Privacy Interventions for AR Creators and End-Users,doi.org/10.1145/3672539.3686708,Shwetha Rajaram,"Augmented reality (AR) is approaching everyday usage, but poses novel privacy concerns for end-users and bystanders due to how AR devices capture users and process physical environments. To enable the benefits of AR while balancing privacy goals, my dissertation develops tools and frameworks to guide AR creators and users to address privacy risks that can arise with AR. First, I explore how to enable AR designers to interactively analyze potential risks in their prototypes through implicit threat modeling within AR authoring tools. Next, through elicitation studies with AR and privacy experts, I contribute frameworks to expand AR interaction models with privacy-friendlier alternatives to traditional AR input, output, and interaction techniques. Lastly, I develop a suite of AI-enabled Privacy Assistant techniques to raise users’ awareness of privacy risks and help them adapt AR interfaces accordingly. Ultimately, my dissertation promotes an AR ecosystem with privacy at the forefront by equipping AR creators and users with a privacy mindset."
UIST,2024,Demos,RelieFoam: Rapid Prototyping of 2.5D Texture using Laser Cutter,doi.org/10.1145/3672539.3686741,"Ayaka Ishii, Kentaro Yasu","We propose RelieFoam, a rapid prototyping method that uses a laser cutter to produce a 2.5D textured surface on polystyrene foam.  Conventional rapid prototyping methods using a laser cutter can quickly create 3D prototypes, but with the limitation that their surfaces can only be flat and smooth. Our method enables the rapid creation of objects with finely detailed 2.5D textured surfaces.  By applying localized high-density energy from a laser cutter to low thermal conductivity polystyrene foam, a laser cutter can selectively remove only the specific parts of the surface of the polystyrene foam being targeted. We have built a computational model that calculates the laser parameters required to engrave the polystyrene foam in this way.  Applying the laser parameters calculated by our model, we are able to implement applications with haptic textures and visual translucency and thus demonstrate the potential of our method. "
UIST,2024,Demos,FlexEOP: Flexible Shape-changing Actuator using Embedded Electroosmotic Pumps,doi.org/10.1145/3672539.3686785,"Tianyu Yu, Yang Liu, Yujia Liu, Qiuyu Lu, Teng Han, Haipeng Mi","Shape-changing actuators have been widely explored in the field of human-computer interaction (HCI), enabling various applications of shape-changing interfaces across from haptic feedback devices to robotics. However it is still challenging for existing methods to build shape-changing actuators that are flexible, capable of complex shape-changing behaviors, and highly self-contained at the same time. In this paper, we proposed FlexEOP, a method to create flexible electroosmotic pumps that are fully composed of flexible materials, facilitating shape-changing actuators with high flexibility and self-containment. We introduced the structure of FlexEOP and then demonstrated the design space of FlexEOP, including shape-changing display on flexible strips, panels, and curved surfaces, and a novel design of soft robotic fiber.  Based on FlexEOP, we envision future applications including wearable tactile devices, curved shape-changing displays, and multi-degree-of-freedom self-contained soft robotics."
UIST,2024,3. Break Q&A: New Vizualizations,avaTTAR: Table Tennis Stroke Training with On-body and Detached Visualization in Augmented Reality,doi.org/10.1145/3654777.3676400,"Dizhi Ma, Xiyun Hu, Jingyu Shi, Mayank Patel, Rahul Jain, Ziyi Liu, Zhengzhe Zhu, Karthik Ramani","Table tennis stroke training is a critical aspect of player development. We designed a new augmented reality (AR) system, avaTTAR, for table tennis stroke training. The system provides both “on-body” (first-person view) and “detached” (third-person view) visual cues, enabling users to visualize target strokes and correct their attempts effectively with this dual perspectives setup. By employing a combination of pose estimation algorithms and IMU sensors, avaTTAR captures and reconstructs the 3D body pose and paddle orientation of users during practice, allowing real-time comparison with expert strokes. Through a user study, we affirm avaTTAR ’s capacity to amplify player experience and training results"
UIST,2024,Workshop - Bridging disciplines for a new era in Physical AI,Bridging disciplines for a new era in Physical AI,doi.org/10.1145/3672539.3686704,"Alexandra Ion, Carmel Majidi, Lining Yao, Amir H. Alavi","Physical AI is extending models from the digital world into performing tasks in the real world. Robots and autonomous cars are common examples of physical AI agents. In this workshop, we aim to go beyond containing physical AI in those agents and ask what if all objects and materials we interact with were intelligent? We aim to form an understanding of the opportunities and challenges of extending agents to include objects and materials that can adapt to users needs, i.e., change shape, firmness, color, tactile properties, etc. This broad vision, which is challenging to achieve, is related to many active research areas, e.g., programmable matter, modular robotics, soft robotics, smart materials, shape-changing interfaces, or radical atoms, and has homes in many disciplines, incl. mechanical engineering, robotics, material science, computer science. Many new approaches are being developed in the individual disciplines that together might be the start of a new era for what we like to call extended physical AI. In this workshop, we bring perspectives from these different disciplines together to exchange new approaches to longstanding challenges (e.g., actuation, computational design, fabrication, control), exchange tacit knowledge, discuss visions for future applications, map the new grand challenges, and inspire the next generation of physical AI research."
UIST,2024,1. Break Q&A: Hacking Perception,Thermal In Motion: Designing Thermal Flow Illusions with Tactile and Thermal Interaction,doi.org/10.1145/3654777.3676460,"Yatharth Singhal, Daniel Honrales, Haokun Wang, Jin Ryong Kim","This study presents a novel method for creating moving thermal sensations by integrating the thermal referral illusion with tactile motion. Conducted through three experiments on human forearms, the first experiment examined the impact of temperature and thermal actuator placement on perceived thermal motion, finding the clearest perception with a centrally positioned actuator under both hot and cold conditions. The second experiment identified the speed thresholds of perceived thermal motion, revealing a wider detectable range in hot conditions (1.8 cm/s to 9.5cm/s) compared to cold conditions (2.4cm/s to 5.0cm/s). Finally, we integrated our approach into virtual reality (VR) to assess its feasibility through two interaction scenarios. Our results shed light on the comprehension of thermal perception and its integration with tactile cues, promising significant advancements in incorporating thermal motion into diverse thermal interfaces for immersive VR experiences."
UIST,2024,Demos,Demonstration of JetUnit: Rendering Diverse Force Feedback in Virtual Reality Using Water Jets,doi.org/10.1145/3672539.3686742,"Zining Zhang, Jiasheng Li, Zeyu Yan, Jun Nishida, Huaishu Peng","JetUnit is a water-based VR haptic system capable of generating a diverse range of perceived force intensities and frequencies through water jets. A key challenge in designing this system was optimizing parameters to enable the haptic device to produce force feedback that closely mimics the most intense force achievable with direct water jets, while ensuring the user remains dry. In this demonstration, we showcase JetUnit by integrating our haptic solutions into various virtual reality interactions, including touch, poking, injection, and recurring pulsing and wave signals."
