conference,year,session name,paper title,DOI,author list,abstract
UIST,2024,2. Break Q&A: Poses as Input,TeleHand: Hand-only Teleportation for Distant Object Pointing in Virtual Reality,https://scholar.google.com/scholar?hl=en&as_sdt=0%2C10&q=TeleHand%3A+Hand-only+Teleportation+for+Distant+Object+Pointing+in+Virtual+Reality,"Karin Ohara, Tsubasa Saito, Takashi Ijiri","The goal of this study is to present an easy-to-use and accurate pointing technique for distant objects in a virtual reality environment. For this purpose, we propose TeleHand pointing, in which the user first teleports only their hand near a target and points at the target using the ray cast from the teleported hand. To evaluate the usability of our method, we performed a user study in which participants repeated selection tasks for distant targets. As a result, we found that, although the proposed method slightly increases the task completion time, it significantly reduces pointing errors for distant targets compared to the traditional ray-based method."
UIST,2024,2. Break Q&A: Movement-based UIs,Efficient Optimal Mouse Sensor Position Estimation using Simulated Cursor Trajectories,https://scholar.google.com/scholar?hl=en&as_sdt=0%2C10&q=Efficient+Optimal+Mouse+Sensor+Position+Estimation+using+Simulated+Cursor+Trajectories,"Minhyeok Baek, Sunjun Kim","The optimal sensor position on a computer mouse can improve pointing performance, but existing calibration methods require time-consuming repetitions of pointing tasks. In this paper, we propose a novel calibration approach that dramatically reduces the time and effort required to determine a user's optimal mouse sensor position. Our method simulates cursor trajectories for different sensor positions using a dual-sensor mouse, eliminating the need for repetitive measurements with multiple sensor placements. By analyzing the straightness of the simulated paths, quantified by the mean absolute error (MAE) relative to an ideal straight-line path, we estimate the sensor position that would yield the most efficient pointing motion for the user. Our preliminary results indicate that the proposed simulation-based calibration method could reduce the calibration time from an hour to just five minutes, while providing a better identification of the optimal mouse sensor positions."
UIST,2024,Demos,MyWebstrates: Webstrates as Local-first Software,https://scholar.google.com/scholar?hl=en&as_sdt=0%2C10&q=MyWebstrates%3A+Webstrates+as+Local-first+Software,"Clemens Nylandsted Klokmose, James R. Eagan, Peter van Hardenberg","Webstrates are web substrates, a practical realization of shareable dynamic media under which distributability, shareability, and malleability are fundamental software principles. Webstrates blur the distinction between application and document in a way that enables users to share, repurpose, and refit software across a variety of domains, but its reliance on a central server constrains its use; it is at odds with personal and collective control of data; and limits applications to the web. We extend the fundamental principles to include \emph{interoperability} and \emph{sovereignty} over data and propose MyWebstrates, an implementation of Webstrates on top of a new, lower-level substrate for synchronization built around local-first software principles. MyWebstrates registers itself in the user’s browser and function as a piece of local software that can selectively synchronise data over sync servers or peer-to-peer connections. We show how MyWebstrates extends Webstrates to enable offline collaborative use, interoperate between Webstrates on non-web technologies such as Unity, and maintain personal and collective sovereignty over data. We demonstrate how this enables new types of applications of Webstrates and discuss limitations of this approach and new challenges that it reveals."
UIST,2024,2. Break Q&A: Future of Typing,Can Capacitive Touch Images Enhance Mobile Keyboard Decoding?,doi.org/10.1145/3654777.3676420,"Piyawat Lertvittayakumjorn, Shanqing Cai, Billy Dou, Cedric Ho, Shumin Zhai","Capacitive touch sensors capture the two-dimensional spatial profile (referred to as a touch heatmap) of a finger's contact with a mobile touchscreen. However, the research and design of touchscreen mobile keyboards -- one of the most speed and accuracy demanding touch interfaces -- has focused on the location of the touch centroid derived from the touch image heatmap as the input, discarding the rest of the raw spatial signals. In this paper, we investigate whether touch heatmaps can be leveraged to further improve the tap decoding accuracy for mobile touchscreen keyboards. Specifically, we developed and evaluated machine-learning models that interpret user taps by using the centroids and/or the heatmaps as their input and studied the contribution of the heatmaps to model performance. The results show that adding the heatmap into the input feature set led to 21.4% relative reduction of character error rates on average, compared to using the centroid alone. Furthermore, we conducted a live user study with the centroid-based and heatmap-based decoders built into Pixel 6 Pro devices and observed lower error rate, faster typing speed, and higher self-reported satisfaction score based on the heatmap-based decoder than the centroid-based decoder. These findings underline the promise of utilizing touch heatmaps for improving typing experience in mobile keyboards."
UIST,2024,Workshop - Democratizing Intelligent Soft Wearables,Democratizing Intelligent Soft Wearables,doi.org/10.1145/3672539.3686707,"Cedric Honnet, Tianhong Catherine Yu, Irmandy Wicaksono, Tingyu Cheng, Andreea Danielescu, Cheng Zhang, Stefanie Mueller, Joe Paradiso, Yiyue Luo","Wearables have long been integral to human culture and daily life. Recent advances in intelligent soft wearables have dramatically transformed how we interact with the world, enhancing our health, productivity, and overall well-being. These innovations, combining advanced sensor design, fabrication, and computational power, offer unprecedented opportunities for monitoring, assistance, and augmentation. However, the benefits of these advancements are not yet universally accessible. Economic and technical barriers often limit the reach of these technologies to domain-specific experts. There is a growing need for democratizing intelligent wearables that are scalable, seamlessly integrated, customized, and adaptive. By bringing researchers from relevant disciplines together, this workshop aims to identify the challenges and investigate opportunities for democratizing intelligent soft wearables within the HCI community via interactive demos, invited keynotes, and focused panel discussions."
UIST,2024,1. Break Q&A: Beyond mobile,LOST STAR: An Interactive Stereoscopic Picture Book Installation for Children's Bedtime Rituals,https://scholar.google.com/scholar?hl=en&as_sdt=0%2C10&q=LOST+STAR%3A+An+Interactive+Stereoscopic+Picture+Book+Installation+for+Children%27s+Bedtime+Rituals,"Jiayi Lu, Xinxin Qiu, Zihan Gao","Sleep disorders in early childhood hinder development and disrupt daily functions, but effective bedtime rituals can help. However, the integration of tangible and virtual interactions in sleep-related design projects remains unexplored. This paper investigates how pop-up books and multimedia can create a playful and accessible way for children to engage in bedtime activities. We present the design of Lost Star, a sonic and tactile Tangible User Interface (TUI) designed to enhance the quality of bedtime rituals for children with sleep problems. Additionally, we explore Joint Media Engagement (JME) to foster meaningful interactions between parents and children, enhancing bedtime routines and improving sleep outcomes."
UIST,2024,2. Break Q&A: Hot Interfaces,Hydroptical Thermal Feedback: Spatial Thermal Feedback Using Visible Lights and Water,doi.org/10.1145/3654777.3676453,"Sosuke Ichihashi, Masahiko Inami, Hsin-Ni Ho, Noura Howell","We control the temperature of materials in everyday interactions, recognizing temperature's important influence on our bodies, minds, and experiences. However, thermal feedback is an under-explored modality in human-computer interaction partly due to its limited temporal (slow) and spatial (small-area and non-moving) capabilities. We introduce hydroptical thermal feedback, a spatial thermal feedback method that works by applying visible lights on body parts in water. Through physical measurements and psychophysical experiments, our results show: (1) Humans perceive thermal sensations when visible lights are cast on the skin under water, and perceived warmth is greater for lights with shorter wavelengths, (2) temporal capabilities, (3) apparent motion (spatial) of warmth and coolness sensations, and (4) hydroptical thermal feedback can support the perceptual illusion that the water itself is warmer. We propose applications, including virtual reality (VR), shared water experiences, and therapies. Overall, this paper contributes hydroptical thermal feedback as a novel method, empirical results demonstrating its unique capabilities, proposed applications, and design recommendations for using hydroptical thermal feedback. Our method introduces controlled, spatial thermal perceptions to water experiences."
UIST,2024,Demos,Fiery Hands: Designing Thermal Glove through Thermal and Tactile Integration for Virtual Object Manipulation,https://scholar.google.com/scholar?hl=en&as_sdt=0%2C10&q=Fiery+Hands%3A+Designing+Thermal+Glove+through+Thermal+and+Tactile+Integration+for+Virtual+Object+Manipulation,"Haokun Wang, Yatharth Singhal, Hyunjae Gil, Jin Ryong Kim","We present a novel approach to render thermal and tactile feedback to the palm and fingertips through thermal and tactile integration. Our approach minimizes the obstruction of the palm and inner side of the fingers and enables virtual object manipulation while providing localized and global thermal feedback. By leveraging thermal actuators positioned strategically on the outer palm and back of the fingers in interplay with tactile actuators, our approach exploits thermal referral and tactile masking phenomena. Through a series of user studies, we validate the perception of localized thermal sensations across the palm and fingers, showcasing the ability to generate diverse thermal patterns. Furthermore, we demonstrate the efficacy of our approach in VR applications,  replicating diverse thermal interactions with virtual objects. This work represents significant progress in thermal interactions within VR, offering enhanced sensory immersion at an optimal energy cost."
UIST,2024,2. Break Q&A: Next Gen Input,PointerVol: A Laser Pointer for Swept Volumetric Displays,doi.org/10.1145/3654777.3676432,"Unai Javier Fernández, Iosune Sarasate Azcona, Iñigo Ezcurdia, Manuel Lopez-Amo, Ivan Fernández, Asier Marzo","A laser pointer is a commonly used device that does not require communication with the display system or modifications on the applications, the presenter can just take a pointer and start using it. When a laser pointer is used on a volumetric display, a line rather than a point appears, making it not suitable for pointing at 3D locations. PointerVol is a modified laser pointer that allows users to point to 3D positions inside a swept volumetric display. We propose two PointerVol implementations based on timing and distance measurements, we evaluate the pointing performance using them. Finally, we present other features such as multi-user pointing, line patterns and a multi-finger wearable. PointerVol is a simple device that can help to popularize volumetric displays, or at least to make them more usable for presentations with true-3D content."
UIST,2024,3. Break Q&A: AI as Copilot,VizGroup: An AI-assisted Event-driven System for Collaborative Programming Learning Analytics,doi.org/10.1145/3654777.3676347,"Xiaohang Tang, Sam Wong, Kevin Pu, Xi Chen, Yalong Yang, Yan Chen","Programming instructors often conduct collaborative learning activities, like Peer Instruction, to foster a deeper understanding in students and enhance their engagement with learning. These activities, however, may not always yield productive outcomes due to the diversity of student mental models and their ineffective collaboration. In this work, we introduce VizGroup, an AI-assisted system that enables programming instructors to easily oversee students' real-time collaborative learning behaviors during large programming courses. VizGroup leverages Large Language Models (LLMs) to recommend event specifications for instructors so that they can simultaneously track and receive alerts about key correlation patterns between various collaboration metrics and ongoing coding tasks. We evaluated VizGroup with 12 instructors in a comparison study using a dataset collected from a Peer Instruction activity that was conducted in a large programming lecture.  The results showed that VizGroup helped instructors effectively overview, narrow down, and track nuances throughout students' behaviors."
UIST,2024,3. Break Q&A: Generating Visuals,ShadowMagic: Designing Human-AI Collaborative Support for Comic Professionals’ Shadowing,doi.org/10.1145/3654777.3676332,"Amrita Ganguly, Chuan Yan, John Joon Young Chung, Tong Steven Sun, YOON KIHEON, Yotam Gingold, Sungsoo Ray Hong","Shadowing allows artists to convey realistic volume and emotion of characters in comic colorization. While AI technologies have the potential to improve professionals’ shadowing experience, current practice is manual and time-consuming. To understand how we can improve their shadowing experience, we conducted interviews with 5 professionals. We found that professionals’ level of engagement can vary depending on semantics, such as characters’ faces or hair. We also found they spent time on shadow “landscaping”—deciding where to place large shadow regions to create a realistic volumetric presentation while the final results can vary dramatically depending on their “staging” and “attention guiding” needs. We discovered they would accept AI suggestions for less engaging semantic parts or landscaping, while needing the capability to adjust details. Based on our observations, we developed ShadowMagic, which (1) generates AI-driven shadows based on commonly used light directions, (2) enables users to selectively choose results depending on semantics, and (3) allows users to complete shadow areas themselves for further perfection. Through a summative evaluation with 5 professionals, we found that they were significantly more satisfied with our AI-driven results compared to a baseline. We also found that ShadowMagic’s “step by step” workflow helps participants more easily adopt AI-driven results. We conclude by providing implications."
UIST,2024,Demos,Demonstrating FIRE: Mid-Air Thermo-Tactile Display,doi.org/10.1145/3672539.3686769,"Yatharth Singhal, Haokun Wang, Jin Ryong Kim","We present an innovative mid-air thermo-tactile display system based on ultrasound haptics. The system features an open-top chamber, heat modules, and an ultrasound haptic display. Our approach directs heated airflow toward the pressure point created by the ultrasound display, delivering thermal and tactile sensations simultaneously in mid-air. We demonstrate our system in four distinct VR environments—campfire, water fountain, kitchen, and candle—highlighting the enhanced user experiences made possible by the integration of thermal and tactile feedback."
UIST,2024,1. Break Q&A: Hacking Perception,Augmented Breathing via Thermal Feedback in the Nose,doi.org/10.1145/3654777.3676438,"Jas Brooks, Alex Mazursky, Janice Hixon, Pedro Lopes","We propose, engineer, and study a novel method to augment the feeling of breathing—enabling interactive applications to let users feel like they are inhaling more/less air (perceived nasal airflow). We achieve this effect by cooling or heating the nose in sync with the user’s inhalation. Our illusion builds on the physiology of breathing: we perceive our breath predominantly through the cooling of our nasal cavities during inhalation. This is why breathing in a “fresh” cold environment feels easier than in a “stuffy” hot environment, even when the inhaled volume is the same. Our psychophysical study confirmed that our in-nose temperature stimulation significantly influenced breathing perception in both directions: making it feel harder & easier to breathe. Further, we found that ~90% of the trials were described as a change in perceived airflow/breathing, while only ~8% as temperature. Following, we engineered a compact device worn across the septum that uses Peltier elements. We illustrate the potential of this augmented breathing in interactive contexts, such as for virtual reality (e.g., rendering ease of breathing crisp air or difficulty breathing with a deteriorated gas mask) and everyday interactions (e.g., in combination with a relaxation application or to alleviate the perceived breathing resistance when wearing a mask)."
UIST,2024,3. Break Q&A: Storytime,Patchview: LLM-powered Worldbuilding with Generative Dust and Magnet Visualization,doi.org/10.1145/3654777.3676352,"John Joon Young Chung, Max Kreminski","Large language models (LLMs) can help writers build story worlds by generating world elements, such as factions, characters, and locations. However, making sense of many generated elements can be overwhelming. Moreover, if the user wants to precisely control aspects of generated elements that are difficult to specify verbally, prompting alone may be insufficient. We introduce Patchview, a customizable LLM-powered system that visually aids worldbuilding by allowing users to interact with story concepts and elements through the physical metaphor of magnets and dust. Elements in Patchview are visually dragged closer to concepts with high relevance, facilitating sensemaking. The user can also steer the generation with verbally elusive concepts by indicating the desired position of the element between concepts. When the user disagrees with the LLM's visualization and generation, they can correct those by repositioning the element. These corrections can be used to align the LLM's future behaviors to the user's perception. With a user study, we show that Patchview supports the sensemaking of world elements and steering of element generation, facilitating exploration during the worldbuilding process. Patchview provides insights on how customizable visual representation can help sensemake, steer, and align generative AI model behaviors with the user's intentions."
UIST,2024,3. Break Q&A: Storytime,DrawTalking: Building Interactive Worlds by Sketching and Speaking,doi.org/10.1145/3654777.3676334,"Karl Toby Rosenberg, Rubaiat Habib Kazi, Li-Yi Wei, Haijun Xia, Ken Perlin","We introduce DrawTalking, an approach to building and controlling interactive worlds by sketching and speaking while telling stories. It emphasizes user control and flexibility, and gives programming-like capability without requiring code. An early open-ended study with our prototype shows that the mechanics resonate and are applicable to many creative-exploratory use cases, with the potential to inspire and inform research in future natural interfaces for creative exploration and authoring."
UIST,2024,1. Break Q&A: FABulous,Speed-Modulated Ironing: High-Resolution Shade and Texture Gradients in Single-Material 3D Printing,doi.org/10.1145/3654777.3676456,"Mehmet Ozdemir, Marwa AlAlawi, Mustafa Doga Dogan, Jose Francisco Martinez Castro, Stefanie Mueller, Zjenja Doubrovski","We present Speed-Modulated Ironing, a new fabrication method for programming visual and tactile properties in single-material 3D printing. We use one nozzle to 3D print and a second nozzle to reheat printed areas at varying speeds, controlling the material's temperature-response. The rapid adjustments of speed allow for fine-grained reheating, enabling high-resolution color and texture variations. We implemented our method in a tool that allows users to assign desired properties to 3D models and creates corresponding 3D printing instructions. We demonstrate our method with three temperature-responsive materials: a foaming filament, a filament with wood fibers, and a filament with cork particles.  These filaments respond to temperature by changing color, roughness, transparency, and gloss. Our technical evaluation reveals the capabilities of our method in achieving sufficient resolution and color shade range that allows surface details such as small text, photos, and QR codes on 3D-printed objects. Finally, we provide application examples demonstrating the new design capabilities enabled by Speed-Modulated Ironing."
UIST,2024,2. Break Q&A: Poses as Input,MobilePoser: Real-Time Full-Body Pose Estimation and 3D Human Translation from IMUs in Mobile Consumer Devices,doi.org/10.1145/3654777.3676461,"Vasco Xu, Chenfeng Gao, Henry Hoffman, Karan Ahuja","There has been a continued trend towards minimizing instrumentation for full-body motion capture, going from specialized rooms and equipment, to arrays of worn sensors and recently sparse inertial pose capture methods. However, as these techniques migrate towards lower-fidelity IMUs on ubiquitous commodity devices, like phones, watches, and earbuds, challenges arise including compromised online performance, temporal consistency, and loss of global translation due to sensor noise and drift. Addressing these challenges, we introduce MobilePoser, a real-time system for full-body pose and global translation estimation using any available subset of IMUs already present in these consumer devices. MobilePoser employs a multi-stage deep neural network for kinematic pose estimation followed by a physics-based motion optimizer, achieving state-of-the-art accuracy while remaining lightweight. We conclude with a series of demonstrative applications to illustrate the unique potential of MobilePoser across a variety of fields, such as health and wellness, gaming, and indoor navigation to name a few.  "
UIST,2024,2. Break Q&A: Dynamic Objects & Materials,Augmented Object Intelligence with XR-Objects,doi.org/10.1145/3654777.3676379,"Mustafa Doga Dogan, Eric J Gonzalez, Karan Ahuja, Ruofei Du, Andrea Colaço, Johnny Lee, Mar Gonzalez-Franco, David Kim","Seamless integration of physical objects as interactive digital entities remains a challenge for spatial computing. This paper explores Augmented Object Intelligence (AOI) in the context of XR, an interaction paradigm that aims to blur the lines between digital and physical by equipping real-world objects with the ability to interact as if they were digital, where every object has the potential to serve as a portal to digital functionalities. Our approach utilizes real-time object segmentation and classification, combined with the power of Multimodal Large Language Models (MLLMs), to facilitate these interactions without the need for object pre-registration. We implement the AOI concept in the form of XR-Objects, an open-source prototype system that provides a platform for users to engage with their physical environment in contextually relevant ways using object-based context menus. This system enables analog objects to not only convey information but also to initiate digital actions, such as querying for details or executing tasks. Our contributions are threefold: (1) we define the AOI concept and detail its advantages over traditional AI assistants, (2) detail the XR-Objects system’s open-source design and implementation, and (3) show its versatility through various use cases and a user study."
UIST,2024,Demos,Haptic Devices with Variable Volume Using Spiral Springs,doi.org/10.1145/3672539.3686752,"Minhyeok Baek, Sunjun Kim","Controllers that convey tactile sensations of object size in virtual environments are crucial for user interaction. However, existing research often faces commercialization constraints due to the complexity and high number of actuators required. This study proposes a haptic device that utilizes a spiral spring structure that offers approximately three times the variable range with a single actuator. This system can quickly render the diameters of objects grasped by users and simulate continuous volume changes, such as inflating a balloon. Due to its simple structure and wide variable range, this system is expected to be suitable for various scenarios, providing users with a more immersive virtual reality experience."
UIST,2024,Demos,DishAgent: Enhancing Dining Experiences through LLM-Based Smart Dishes,doi.org/10.1145/3672539.3686755,"Cheng Xue, Yijie Guo, ziyi wang, Mona Shimizu, Jihong Jeung, Haipeng Mi","With the rapid advancement of smart technologies, there is an increasing demand to enhance everyday experiences, including dining. Recent Human-Computer Interaction (HCI) research has begun to emphasize the aesthetic, affective, sensual, and sociocultural qualities of directly interacting with food. However, these technologies are often constrained by the material properties of food, limiting their everyday applicability. This research introduces DishAgent, an innovative device equipped with a Large Language Model (LLM)-based smart dish and a swarm robotics system. DishAgent adapts to various dining scenarios by generating appropriate conversational contexts and coordinating the action commands of swarm robots, thereby enhancing the dining experience through real-time interaction. This paper explores the applications of DishAgent in intelligent dining guidance, dietary behavior intervention, food information query and social companionship., aiming to fill the critical gap in current technologies for simply and intuitively enhancing dining experiences."
